{"asi": {"bounded_resources": "The change removes transient allocations and adds no retained state. Every identifier admitted to a bounded cache is converted to an owned string first.", "safety": "Rust lifetimes prevent a resolved target from outliving its request context. Unicode normalization behavior is preserved and covered for both unchanged lowercase and changed uppercase values.", "summary": "Canonical account and namespace values are borrowed through one authorization evaluation, while values that change during trim or lowercase normalization remain owned. Payment-required matching now reuses that normalized account.", "validation": "Two paired eight-worker runs improved account and project target resolution by 1.397876 and 1.464943 times. Focused authorization tests passed."}, "commit": "7acd120", "confidence": null, "description": "perf(kura): normalize authorization targets once", "metric": 1.397876, "metrics": {"baseline_max_targets_per_second": 78665310.844, "candidate_min_targets_per_second": 110913930.79, "maximum_paired_speedup_ratio": 1.464943, "minimum_paired_speedup_ratio": 1.397876}, "run": 66, "segment": 45, "status": "keep", "timestamp": 1788434985209}
{"bestDirection": "higher", "maxIterations": 3, "metricName": "normalized_payment_required_speedup_ratio", "metricUnit": "x", "name": "Reuse normalized payment account", "timestamp": 1788434994640, "type": "config"}
{"asi": {"bounded_resources": "One transient string allocation is removed from each payment-required evaluation and no retained state changes.", "safety": "Both grant handles and request targets are normalized at construction. Existing authorization grant tests and the full focused authorization suite pass.", "summary": "Payment-required grant matching now compares against the account already normalized by request resolution instead of allocating and lowercasing it again.", "validation": "Two paired eight-worker runs improved payment-required matching by 6.708687 and 7.218561 times."}, "commit": "a4ca422", "confidence": null, "description": "test(kura): record normalized payment benchmark", "metric": 6.708687, "metrics": {"baseline_max_checks_per_second": 352943771.645, "candidate_min_checks_per_second": 1994763745.169, "maximum_paired_speedup_ratio": 7.218561, "minimum_paired_speedup_ratio": 6.708687}, "run": 67, "segment": 46, "status": "keep", "timestamp": 1788435011176}
{"bestDirection": "higher", "maxIterations": 3, "metricName": "ascii_normalization_speedup_ratio", "metricUnit": "x", "name": "Fast-path canonical authorization text", "timestamp": 1788435074621, "type": "config"}
{"asi": {"bounded_resources": "The scan uses fixed stack state, removes work from the common path, and adds no allocation or retained state.", "safety": "Uppercase American Standard Code for Information Interchange bytes fail immediately. Non-ASCII input still runs the original per-character lowercase equivalence check, including characters whose lowercase expands to multiple code points.", "summary": "Canonical American Standard Code for Information Interchange identifiers now take one byte scan, while uncommon non-ASCII identifiers retain exact Unicode lowercase expansion checks.", "validation": "Two paired eight-worker runs improved the canonical scan by 4.252860 and 5.133652 times. Focused checks passed."}, "commit": "8b2435f", "confidence": null, "description": "perf(kura): fast-path canonical authorization text", "metric": 4.25286, "metrics": {"baseline_max_scans_per_second": 232798659.801, "candidate_min_scans_per_second": 737389510.247, "maximum_paired_speedup_ratio": 5.133652, "minimum_paired_speedup_ratio": 4.25286}, "run": 68, "segment": 47, "status": "keep", "timestamp": 1788435157811}
{"bestDirection": "higher", "maxIterations": 3, "metricName": "authorization_target_speedup_ratio", "metricUnit": "x", "name": "Confirm final authorization target resolution", "timestamp": 1788435166359, "type": "config"}
{"asi": {"bounded_resources": "The resolver retains no additional state and every bounded cache key remains owned.", "safety": "The benchmark executes the old allocating resolver and final resolver against alternating account and project contexts. Focused correctness checks run after it.", "summary": "The complete final account and project target resolver combines borrowed canonical values with the byte-oriented canonical-text scan.", "validation": "Two final paired eight-worker confirmations improved complete target resolution by 2.455314 and 2.524871 times."}, "commit": "2a625c2", "confidence": null, "description": "test(kura): confirm final target normalization", "metric": 2.455314, "metrics": {"baseline_max_targets_per_second": 54015975.711, "candidate_min_targets_per_second": 122421497.215, "maximum_paired_speedup_ratio": 2.524871, "minimum_paired_speedup_ratio": 2.455314}, "run": 69, "segment": 48, "status": "keep", "timestamp": 1788435178971}
{"bestDirection": "higher", "maxIterations": 3, "metricName": "keyvalue_auth_context_speedup_ratio", "metricUnit": "x", "name": "Remove unused authorization request facts", "timestamp": 1788435774794, "type": "config"}
{"asi": {"bounded_resources": "The route handler retains the same configured key-value body limit. Removing the middleware copy lowers peak live memory and adds no queue, cache, or retained state.", "safety": "Authorization only consumes transport, method, operation, tenant, namespace, and credential fields. Focused authorization context, key-value round-trip, and Remote Execution context tests passed.", "summary": "Authorization contexts now carry only facts the policy reads. Key-value request bodies are no longer buffered and decoded in middleware solely to populate unused artifact metadata, so the route handler is their only materialization and decode point.", "validation": "Two paired eight-worker construction runs improved the key-value authorization setup by 7.323046 and 7.485470 times."}, "commit": "3cc1ed5", "confidence": null, "description": "perf(kura): remove unused authorization request facts", "metric": 7.323046, "metrics": {"baseline_max_contexts_per_second": 7125467.82, "candidate_min_contexts_per_second": 45999032.87, "maximum_paired_speedup_ratio": 7.48547, "minimum_paired_speedup_ratio": 7.323046}, "run": 70, "segment": 49, "status": "keep", "timestamp": 1788435859083}
{"bestDirection": "higher", "maxIterations": 3, "metricName": "authorization_query_speedup_ratio", "metricUnit": "x", "name": "Scan only authorization query fields", "timestamp": 1788435989020, "type": "config"}
{"asi": {"bounded_resources": "The scanner retains five borrowed slices and allocates only the tenant and namespace values that enter the short-lived authorization context. It adds no retained memory or concurrency.", "safety": "Tests pin canonical-key precedence over aliases, last duplicate wins, empty canonical values shadow aliases, and multipart lookup behavior. The scanner preserves the previous non-decoding query interpretation.", "summary": "Authorization now scans the raw query once and borrows only tenant, namespace, and multipart upload values instead of allocating every key and value into a hash map that the route handler later reparses.", "validation": "Two paired eight-worker runs improved authorization query extraction by 5.333640 and 5.783401 times."}, "commit": "2e6ab1d", "confidence": null, "description": "perf(kura): scan only authorization query fields", "metric": 5.33364, "metrics": {"baseline_max_queries_per_second": 6273481.445, "candidate_min_queries_per_second": 27179744.871, "maximum_paired_speedup_ratio": 5.783401, "minimum_paired_speedup_ratio": 5.33364}, "run": 71, "segment": 50, "status": "keep", "timestamp": 1788436078601}
{"bestDirection": "higher", "metricName": "reapi_batch_analytics_speedup_ratio", "metricUnit": "x", "name": "Share Remote Execution batch analytics attribution", "timestamp": 1788441708798, "type": "config"}
{"asi": {"bounded_resources": "The analytics channel still consumes one existing bounded queue slot per observed blob. Sharing removes repeated retained strings and does not raise queue, memory, worker, or request limits.", "safety": "Manual serialization preserves the existing thirteen-field payload, while focused tests verify delivered JSON and shared pointer identity. Non-Bazel and disabled-analytics requests retain their early exits.", "summary": "Remote Execution batch cache events parse request attribution once and share one immutable context allocation across every per-blob event.", "validation": "Two paired runs improved event construction by at least 22.460794 and 32.487144 times; focused analytics checks and payload serialization tests passed."}, "commit": "7c65fc4", "confidence": null, "description": "perf(kura): share batch analytics attribution", "metric": 22.460794, "metrics": {"baseline_events_per_second": 1952323.431, "maximum_paired_speedup_ratio": 31.82217, "shared_context_events_per_second": 47866334.197}, "run": 72, "segment": 51, "status": "keep", "timestamp": 1788441905742}
{"bestDirection": "higher", "metricName": "saturated_analytics_enqueue_speedup_ratio", "metricUnit": "x", "name": "Avoid saturated analytics queue allocations", "timestamp": 1788442032594, "type": "config"}
{"asi": {"bounded_resources": "Reservation uses the existing non-waiting channel capacity and neither adds slots nor waits. Each accepted event still consumes exactly one configured queue slot.", "safety": "A focused test proves a full queue does not invoke the constructor. The pending count is now published before the reserved event becomes visible, preventing a receiver race while preserving drop metrics.", "summary": "Analytics producers reserve a bounded channel slot before constructing an event, eliminating allocations for events that saturation will drop.", "validation": "The paired saturated-queue benchmark improved rejected enqueue attempts by at least 13.137996 times, from 53.51 million to 714.75 million attempts per second; focused analytics checks passed."}, "commit": "a25eae3", "confidence": null, "description": "perf(kura): reserve analytics capacity before allocation", "metric": 13.137996, "metrics": {"construct_then_send_attempts_per_second": 53511347.75, "maximum_paired_speedup_ratio": 13.60887, "reserve_then_construct_attempts_per_second": 714753878.076}, "run": 73, "segment": 52, "status": "keep", "timestamp": 1788442129444}
{"bestDirection": "higher", "metricName": "analytics_queue_metric_speedup_ratio", "metricUnit": "x", "name": "Pre-resolve analytics queue metrics", "timestamp": 1788442222310, "type": "config"}
{"asi": {"bounded_resources": "The optimization adds four constant-size metric handles only when analytics is enabled. The channel, pending count, queue capacity, batching, workers, and retry behavior remain unchanged.", "safety": "A focused test verifies exact enqueue and drop counts together with queue depth and capacity. Four paired concurrent runs retained a clear gain, and focused analytics checks pass.", "summary": "Analytics producers update pre-resolved enqueue and drop counters plus queue gauges without allocating labels or acquiring the metric-family lookup lock for every admitted event.", "validation": "The conservative minimum paired speedup was 2.642242 times across four eight-producer runs; the final candidate sustained 25.96 million events per second versus 5.97 million before."}, "commit": "55bf275", "confidence": null, "description": "perf(kura): pre-resolve analytics queue metrics", "metric": 2.642242, "metrics": {"family_lookup_events_per_second": 5971855.778, "maximum_paired_speedup_ratio": 4.816737, "resolved_handle_events_per_second": 25961698.382}, "run": 74, "segment": 53, "status": "keep", "timestamp": 1788442736280}
{"bestDirection": "higher", "metricName": "http_response_admission_metric_speedup_ratio", "metricUnit": "x", "name": "Pre-resolve HTTP response admission metrics", "timestamp": 1788442775224, "type": "config"}
{"asi": {"bounded_resources": "The optimization adds three constant-size metric handles. It does not alter the response byte semaphores, transient-memory accounting, bounded waiter queue, admission lock, timeout, or degraded-stream ceiling.", "safety": "Dynamic protocols and non-success outcomes retain the existing labeled-family fallback. Existing metric rendering validation proves the registered series and observations remain available.", "summary": "Successful Hypertext Transfer Protocol response admission updates pre-resolved counters and a histogram instead of allocating labels and acquiring metric-family lookup locks per read.", "validation": "Two eight-producer paired runs improved successful admission accounting by at least 6.907303 times; the confirmation sustained 24.84 million admissions per second versus 3.10 million before, and focused checks passed."}, "commit": "b8e13f8", "confidence": null, "description": "perf(kura): pre-resolve HTTP response admission metrics", "metric": 6.907303, "metrics": {"family_lookup_admissions_per_second": 3101172.853, "maximum_paired_speedup_ratio": 17.384934, "resolved_handle_admissions_per_second": 24835946.929}, "run": 75, "segment": 54, "status": "keep", "timestamp": 1788442914317}
{"bestDirection": "higher", "metricName": "response_waiter_metric_speedup_ratio", "metricUnit": "x", "name": "Pre-resolve response waiter gauges", "timestamp": 1788442931947, "type": "config"}
{"asi": {"bounded_resources": "The change adds two constant-size gauge handles and does not alter the fixed waiter semaphore, byte admission semaphores, queue capacity, fair admission turn, timeout, or memory accounting.", "safety": "Only the two production foreground protocol names use direct handles. Unknown protocols retain the existing family lookup, and existing metric export coverage exercises the registered ByteStream waiter series.", "summary": "Foreground response waiters update pre-resolved Hypertext Transfer Protocol and ByteStream gauges instead of allocating labels and acquiring a metric-family lock on queue entry and exit.", "validation": "Two eight-producer paired runs improved complete waiter accounting by at least 11.906352 times; confirmation sustained 41.71 million cycles per second versus 3.18 million before, and focused checks passed."}, "commit": "69d65ff", "confidence": null, "description": "perf(kura): pre-resolve response waiter gauges", "metric": 11.906352, "metrics": {"family_lookup_waiter_cycles_per_second": 3180565.688, "maximum_paired_speedup_ratio": 14.383079, "resolved_handle_waiter_cycles_per_second": 41711654.424}, "run": 76, "segment": 55, "status": "keep", "timestamp": 1788443055753}
