{"asi":{"baseline_admissions_per_second":334579.981,"candidate_admissions_per_second":2342159,"change":"pre-resolve hot response reservation gauges and retain one narrow metrics handle","resource_bounds":"unchanged","speedup_ratio":7.0},"commit":"working-tree","confidence":null,"description":"perf(kura): narrow response stream metrics ownership","metric":2342159,"metrics":{},"run":33,"segment":19,"status":"keep","timestamp":1788403017001}
{"asi":{"candidate_admissions_per_second":3377169.7,"paired_baseline_admissions_per_second":2747222.879,"paired_speedup_ratio":1.229882,"proof":"foreground and background capacities are disjoint and sum to the global response budget","retained_bounds":["transient memory","foreground bytes","background bytes","elastic bytes","waiter count","degraded slots"]},"commit":"working-tree","confidence":null,"description":"perf(kura): remove redundant response byte limiter","metric":3377169.7,"metrics":{},"run":34,"segment":19,"status":"keep","timestamp":1788403017002}
{"asi":{"buildbarn":{"p50_ms":9,"p95_ms":15,"p99_ms":18,"reads_per_second":6105.49},"concurrency":64,"kura":{"p50_ms":8,"p95_ms":12,"p99_ms":16,"reads_per_second":6914.2},"objects":5000,"payload_gibibytes":1.25,"requests":100000,"success":"all","throughput_lead_percent":13.2},"commit":"working-tree","confidence":null,"description":"benchmark(kura): sustained fair read comparison at concurrency 64","metric":6914.2,"metrics":{},"run":35,"segment":20,"status":"keep","timestamp":1788403017003}
{"asi":{"buildbarn":{"p50_ms":78,"p95_ms":105,"p99_ms":114,"reads_per_second":6205.27},"concurrency":512,"kura":{"p50_ms":71,"p95_ms":129,"p99_ms":169,"reads_per_second":6737.4},"objects":5000,"payload_gibibytes":1.25,"requests":100000,"success":"all","throughput_lead_percent":8.6},"commit":"working-tree","confidence":null,"description":"benchmark(kura): sustained fair read comparison at concurrency 512","metric":6737.4,"metrics":{},"run":36,"segment":20,"status":"keep","timestamp":1788403017004}
{"asi":{"finding":"lock-free direct-mapped manifest front added permanent slots and invalidation state without improving end-to-end throughput","decision":"retain shared manifest allocation and global bounded recency cache"},"commit":"working-tree","confidence":null,"description":"Add fixed-memory lock-free manifest front","metric":0,"metrics":{},"run":37,"segment":21,"status":"discard","timestamp":1788403017005}
{"bestDirection": "higher", "maxIterations": 6, "metricName": "io_metrics_borrow_speedup_ratio", "metricUnit": "x", "name": "Eliminate Kura hot-path metrics ownership churn", "timestamp": 1788416858360, "type": "config"}
{"asi": {"baseline_accesses_per_second": 2532786.414, "candidate_accesses_per_second": 405988327.836, "end_to_end_concurrency_512": {"baseline_median_reads_per_second": 7075.95, "candidate_median_reads_per_second": 7060.79, "decision": "within host noise"}, "end_to_end_concurrency_64": {"baseline_median_reads_per_second": 7303.26, "candidate_median_reads_per_second": 7950.98, "speedup_percent": 8.868}, "finding": "IoController::metrics clones the complete metrics registry at least twice per successful ByteStream read", "profile": "four concurrent 128-stream clients", "resource_bounds": "unchanged", "speedup_ratio": 158.695467}, "commit": "3435fe5", "confidence": null, "description": "perf(kura): borrow hot-path metrics registry", "metric": 158.695467, "metrics": {"io_metrics_borrow_candidate_per_second": 405988327.836, "io_metrics_clone_baseline_per_second": 2532786.414}, "run": 38, "segment": 18, "status": "keep", "timestamp": 1788416953204}
{"bestDirection": "higher", "maxIterations": 6, "metricName": "blob_resource_parse_speedup_ratio", "metricUnit": "x", "name": "Remove ByteStream resource parsing churn", "timestamp": 1788417364343, "type": "config"}
{"asi": {"allocations_removed": ["component vector", "intermediate digest string"], "behavior": "equivalent normalization, final marker selection, and errors", "final_single_pass_speedup_ratio": 1.92524, "first_multi_scan_speedup_ratio": 0.813934, "resource_bounds": "unchanged"}, "commit": "c25328b", "confidence": null, "description": "perf(kura): parse blob resources without temporary allocations", "metric": 1.92524, "metrics": {"blob_resource_parse_baseline_per_second": 3314474.877, "blob_resource_parse_candidate_per_second": 6395814.579}, "run": 39, "segment": 19, "status": "keep", "timestamp": 1788417684269}
{"bestDirection": "higher", "maxIterations": 6, "metricName": "segment_preload_speedup_ratio", "metricUnit": "x", "name": "Remove small-write preload initialization", "timestamp": 1788418718649, "type": "config"}
{"asi": {"allocation": "fallible with existing streamed-copy fallback", "durability": "unchanged append and synchronization path", "file_descriptor_acquisition": "after successful allocation", "memory_admission": "unchanged foreground reservation", "paired_speedup_ratios": [1.530432, 1.564657], "read_bound": "limited to admitted artifact size", "validation": ["exact size", "truncated source", "allocation failure"], "zero_fill_removed_bytes_per_qualifying_write": 262144}, "commit": "478d1d5", "confidence": null, "description": "perf(kura): read small write preloads without zero fill", "metric": 1.564657, "metrics": {"segment_preload_baseline_mebibytes_per_second": 27569.094, "segment_preload_candidate_mebibytes_per_second": 39421.32}, "run": 40, "segment": 20, "status": "keep", "timestamp": 1788419793144}
{"bestDirection": "higher", "maxIterations": 8, "metricName": "durable_bytestream_writes_per_second", "metricUnit": "writes_per_second", "name": "Eliminate memory-resident upload staging files", "timestamp": 1788420151025, "type": "config"}
{"asi": {"baseline_latency_ms": {"p50": 255, "p95": 558, "p99": 762}, "candidate_latency_ms": {"p50": 308, "p95": 742, "p99": 1016}, "finding": "removing staging stagger synchronized arrivals at the durable commit path and regressed sustained throughput", "resource_model": "same admitted source-plus-destination bytes; temporary disk and descriptors reduced", "workload": {"chunks_per_write": 4, "concurrency": 64, "payload_kibibytes": 256, "requests": 5000}}, "commit": "478d1d5", "confidence": null, "description": "Keep small ByteStream uploads in admitted memory", "metric": 181.92, "metrics": {"baseline_durable_writes_per_second": 213.17, "candidate_durable_writes_per_second": 181.92, "throughput_change_percent": -14.66}, "run": 41, "segment": 21, "status": "discard", "timestamp": 1788421004412}
{"bestDirection": "higher", "maxIterations": 6, "metricName": "write_batch_handoff_speedup_ratio", "metricUnit": "x", "name": "Move RocksDB write batches to blocking workers", "timestamp": 1788421019883, "type": "config"}
{"asi": {"bounded_resources": "The same batch, database, write options, admission controls, and durability barriers remain in use. No queue, memory, or concurrency bound changed.", "safety": "The resolved rocksdb 0.24 binding explicitly marks WriteBatch as Send. Ownership moves into the blocking closure, eliminating an allocation and copy without introducing shared mutation.", "summary": "Moved RocksDB WriteBatch values directly into blocking workers instead of serializing them into a temporary byte vector and reconstructing them.", "validation": "Two isolated paired runs were 1.427748x and 1.330330x faster. A fresh 5000-request, concurrency-64 service pair improved from 162.84 to 176.15 writes per second with lower median, 95th-percentile, and 99th-percentile latency."}, "commit": "aeaa6b4", "confidence": null, "description": "perf(kura): move write batches to blocking workers", "metric": 1.33033, "metrics": {"baseline_p50_ms": 328.0, "baseline_p95_ms": 802.0, "baseline_p99_ms": 1138.0, "candidate_p50_ms": 303.0, "candidate_p95_ms": 694.0, "candidate_p99_ms": 932.0, "fresh_baseline_writes_per_second": 162.84, "fresh_candidate_writes_per_second": 176.15, "maximum_paired_handoff_speedup_ratio": 1.427748, "minimum_paired_handoff_speedup_ratio": 1.33033, "throughput_change_percent": 8.17}, "run": 42, "segment": 22, "status": "keep", "timestamp": 1788421525452}
{"bestDirection": "higher", "maxIterations": 4, "metricName": "streaming_write_buffer_speedup_ratio", "metricUnit": "x", "name": "Remove streaming write buffer zero fill", "timestamp": 1788421806580, "type": "config"}
{"asi": {"bounded_resources": "The buffer remains capped at 262144 bytes, is reused for all chunks, and remains inside the existing serialized segment append. No queue, concurrency, file-cache, or durability bound changed.", "safety": "Tokio read_buf initializes only the bytes it reports and safely advances the vector length. The exact-capacity allocation is now fallible and returns an error instead of using an infallible zero-filled allocation.", "summary": "Large staged writes now read into the reusable vector spare capacity instead of zero-filling the 256-kibibyte segment copy buffer before the source overwrites it.", "validation": "Paired one-mebibyte streaming-copy benchmarks were 1.206748x and 1.183087x faster. The bounded replicated path integration test passed, including final file-cache release behavior."}, "commit": "666ff97", "confidence": null, "description": "perf(kura): avoid zeroing streaming write buffers", "metric": 1.183087, "metrics": {"baseline_mebibytes_per_second": 34923.924, "buffer_bytes": 262144.0, "candidate_mebibytes_per_second": 40075.467, "maximum_paired_speedup_ratio": 1.206748, "minimum_paired_speedup_ratio": 1.183087}, "run": 43, "segment": 23, "status": "keep", "timestamp": 1788422009253}
{"bestDirection": "higher", "maxIterations": 4, "metricName": "http2_connection_window_speedup_ratio", "metricUnit": "x", "name": "Increase bounded HTTP2 connection credit", "timestamp": 1788422045412, "type": "config"}
{"asi": {"bounded_resources": "Both variants retained the same response-memory semaphore, per-stream send-buffer cap, and 512-stream ceiling. The smaller retained credit is also the tighter transport bound.", "decision": "Retain the 16-mebibyte fixed connection window. It schedules admitted work more smoothly and remains comfortably above the per-stream window.", "finding": "A 64-mebibyte connection window released larger response bursts into one HTTP2 connection and reduced throughput while worsening latency."}, "commit": "666ff97", "confidence": null, "description": "Raise HTTP2 connection window from 16 to 64 MiB", "metric": 0.524691, "metrics": {"baseline_median_p50_ms": 87.0, "baseline_median_p95_ms": 179.0, "baseline_median_p99_ms": 241.0, "baseline_median_reads_per_second": 5184.4, "candidate_median_p50_ms": 167.0, "candidate_median_p95_ms": 337.0, "candidate_median_p99_ms": 450.0, "candidate_median_reads_per_second": 2720.23, "speedup_ratio": 0.524691}, "run": 44, "segment": 24, "status": "discard", "timestamp": 1788422412377}
{"bestDirection": "higher", "maxIterations": 5, "metricName": "segment_group_commit_speedup_ratio", "metricUnit": "x", "name": "Tune bounded segment durability cohort window", "timestamp": 1788422431548, "type": "config"}
{"asi": {"decision": "Retain the adaptive one-millisecond-per-writer delay capped at 40 milliseconds.", "finding": "An 8-millisecond cap briefly reduced the first burst latency but formed smaller durability cohorts, causing more filesystem synchronizations and lower sustained throughput.", "safety": "Both variants kept the same sequence-based durability protocol. The retained setting has the stronger measured batching efficiency without weakening crash ordering or memory bounds."}, "commit": "666ff97", "confidence": null, "description": "Lower segment durability cohort cap from 40 to 8 ms", "metric": 0.956102, "metrics": {"baseline_median_p50_ms": 274.0, "baseline_median_p95_ms": 627.0, "baseline_median_p99_ms": 855.0, "baseline_median_writes_per_second": 197.05, "candidate_median_p50_ms": 273.0, "candidate_median_p95_ms": 662.0, "candidate_median_p99_ms": 948.0, "candidate_median_writes_per_second": 188.4, "speedup_ratio": 0.956102}, "run": 45, "segment": 25, "status": "discard", "timestamp": 1788422616715}
{"bestDirection": "higher", "maxIterations": 5, "metricName": "http2_send_buffer_speedup_ratio", "metricUnit": "x", "name": "Reduce bounded HTTP2 per-stream send buffering", "timestamp": 1788422672440, "type": "config"}
{"asi": {"bounded_resources": "For a 256-kibibyte read, the charged reservation falls from 811008 to 606208 bytes because the transport owner is now physically capped at 65536 bytes. The global response semaphore, transient-memory semaphore, stream ceiling, and bounded waiter queue remain unchanged. Degraded HTTP reads now add the transport cap to their remaining live chunks so the smaller cap cannot under-account them.", "safety": "Upstream h2 documentation states the limit is per stream and stops polling more capacity once the stream reaches it. The focused transport-lifetime test, degraded-memory tests, production build, and formatting check passed.", "summary": "Capped each Hyper HTTP2 stream send buffer at 64 kibibytes and changed ByteStream admission from three full chunks to two full chunks plus that explicit send-buffer cap.", "validation": "Two constrained-memory reversals improved median throughput by about 33.3 and 19.7 percent at concurrency 256. At unconstrained memory the 512-way result was within host variation, about 1.9 percent lower in the immediate median comparison."}, "commit": "63dfd74", "confidence": null, "description": "perf(kura): tighten response send buffering", "metric": 1.19683, "metrics": {"baseline_reservation_bytes": 811008.0, "candidate_reservation_bytes": 606208.0, "maximum_constrained_speedup_ratio": 1.33323, "minimum_constrained_speedup_ratio": 1.19683, "reservation_reduction_percent": 25.2525, "send_buffer_bytes_after": 65536.0, "send_buffer_bytes_before": 524288.0, "unconstrained_candidate_to_baseline_ratio": 0.981221}, "run": 46, "segment": 26, "status": "keep", "timestamp": 1788423214249}
{"bestDirection": "higher", "maxIterations": 4, "metricName": "digest_comparison_speedup_ratio", "metricUnit": "x", "name": "Compare write digests without hex allocation", "timestamp": 1788423246841, "type": "config"}
{"asi": {"bounded_resources": "The candidate removes one heap allocation per completed write and adds only a fixed 32-byte stack array. No admission, disk, concurrency, or durability behavior changes.", "safety": "The same computed SHA-256 digest is compared exactly. Focused tests cover equality, mismatch, malformed hexadecimal input, and the wrong encoded length.", "summary": "Successful ByteStream writes now decode the expected hexadecimal SHA-256 digest into a fixed 32-byte stack array and compare digest bytes directly, instead of allocating and formatting an encoded string from the computed digest.", "validation": "Two paired runs improved the comparison from roughly 6.63 million per second to 25.93 million or more per second, a minimum 3.845204x speedup."}, "commit": "02eedec", "confidence": null, "description": "perf(kura): compare write digests without allocation", "metric": 3.845204, "metrics": {"baseline_comparisons_per_second": 6629713.396, "candidate_comparisons_per_second": 25933889.743, "maximum_paired_speedup_ratio": 4.121954, "minimum_paired_speedup_ratio": 3.845204, "removed_heap_allocations_per_write": 1.0}, "run": 47, "segment": 27, "status": "keep", "timestamp": 1788423354845}
{"bestDirection": "higher", "maxIterations": 4, "metricName": "blob_resource_construction_speedup_ratio", "metricUnit": "x", "name": "Store one digest copy in parsed blob resources", "timestamp": 1788423379794, "type": "config"}
{"asi": {"bounded_resources": "Each normal SHA-256 request removes one heap allocation and 64 copied digest bytes. The result remains fully owned and does not borrow request memory.", "safety": "The range is constructed from the exact blob/ prefix and digest length used to build the key, so both endpoints are valid UTF-8 boundaries. Read and write parser tests passed.", "summary": "Parsed ByteStream resources now retain the digest as a byte range into their already-owned storage key instead of allocating a second String.", "validation": "Two paired runs improved isolated resource construction by 1.946463x and 1.996780x."}, "commit": "dfebcc0", "confidence": null, "description": "perf(kura): retain one parsed digest copy", "metric": 1.946463, "metrics": {"maximum_paired_speedup_ratio": 1.99678, "minimum_paired_speedup_ratio": 1.946463, "removed_digest_payload_bytes_per_sha256_request": 64.0, "removed_heap_allocations_per_request": 1.0}, "run": 48, "segment": 28, "status": "keep", "timestamp": 1788423571887}
{"bestDirection": "higher", "maxIterations": 4, "metricName": "reapi_write_metrics_speedup_ratio", "metricUnit": "x", "name": "Resolve successful REAPI write metrics once", "timestamp": 1788423601380, "type": "config"}
{"asi": {"bounded_resources": "The change adds exactly three fixed metric handles per Metrics registry and removes per-write label allocation. All existing admission, memory, disk, and durability limits are unchanged.", "safety": "The handles come from the same registered counter and histogram families, so rendered series names and labels are unchanged. The focused rendering test and 5000-write end-to-end run passed.", "summary": "Successful REAPI writes now update three metric handles resolved once at startup instead of allocating labels and looking up three metric families for every completed write.", "validation": "Two paired microbenchmarks improved metric recording by 11.720373x and 12.117167x. A fresh-store durable write comparison was within noise at 222.4 versus 223.99 writes per second, with every write successful."}, "commit": "6325bf0", "confidence": null, "description": "perf(kura): pre-resolve successful write metrics", "metric": 11.720373, "metrics": {"baseline_durable_writes_per_second": 222.4, "candidate_durable_writes_per_second": 223.99, "end_to_end_speedup_ratio": 1.00715, "maximum_paired_speedup_ratio": 12.117167, "minimum_paired_speedup_ratio": 11.720373, "successful_writes": 5000.0}, "run": 49, "segment": 29, "status": "keep", "timestamp": 1788423960212}
{"bestDirection": "higher", "maxIterations": 4, "metricName": "bytestream_write_latency_metrics_speedup_ratio", "metricUnit": "x", "name": "Pre-resolve ByteStream write request accounting", "timestamp": 1788424032949, "type": "config"}
{"asi": {"bounded_resources": "The change adds one fixed histogram handle and removes per-request heap work. Request admission, inflight tracking, latency sampling, response lifetime, and all resource caps are unchanged.", "safety": "The handle belongs to the same registered metric family and label set. Focused metric rendering and route ownership tests passed, as did 5000 durable writes per variant.", "summary": "ByteStream write request accounting now borrows its static route and observes a latency histogram resolved once at startup, eliminating route and label allocations plus a metric-family lookup.", "validation": "Two paired microbenchmarks improved latency observation by 7.745643x and 8.052481x. End-to-end durable writes remained host-noise-bound; the reverse-order fresh-store pair was 194.24 versus 190.84 writes per second, a 1.75 percent difference."}, "commit": "064614f", "confidence": null, "description": "perf(kura): pre-resolve write latency metrics", "metric": 7.745643, "metrics": {"maximum_paired_speedup_ratio": 8.052481, "minimum_paired_speedup_ratio": 7.745643, "reverse_pair_baseline_writes_per_second": 194.24, "reverse_pair_candidate_writes_per_second": 190.84, "reverse_pair_ratio": 0.982496, "successful_writes_per_variant": 5000.0}, "run": 50, "segment": 30, "status": "keep", "timestamp": 1788424361902}
{"bestDirection": "higher", "maxIterations": 4, "metricName": "write_admission_metrics_clone_speedup_ratio", "metricUnit": "x", "name": "Narrow write admission metric ownership", "timestamp": 1788424397044, "type": "config"}
{"asi": {"bounded_resources": "The fixed group contains three already-registered metric handles. Per-request state is smaller, while memory reservations, stream staging, decode accounting, concurrency limits, and disk durability are unchanged.", "safety": "Both rejection paths update the same metric families and labels through pre-resolved handles. The resource-exhaustion metric test passed, as did 10000 durable writes per binary at concurrency 256.", "summary": "Incoming remote-execution writes now clone one small shared rejection-metrics group instead of the full Metrics aggregate twice while admission ownership is split between request extensions and the body wrapper.", "validation": "Two paired clone benchmarks improved by 80.187870x and 96.422518x. The exact production binary comparison on 4-kibibyte writes improved from 224.07 to 231.82 writes per second, 3.46 percent, with median latency falling from 705 to 654 milliseconds."}, "commit": "1b2a422", "confidence": null, "description": "perf(kura): narrow write admission metrics", "metric": 80.18787, "metrics": {"baseline_p50_ms": 705.0, "baseline_writes_per_second": 224.07, "candidate_p50_ms": 654.0, "candidate_writes_per_second": 231.82, "end_to_end_speedup_ratio": 1.03459, "maximum_paired_speedup_ratio": 96.422518, "minimum_paired_speedup_ratio": 80.18787, "successful_writes_per_variant": 10000.0}, "run": 51, "segment": 31, "status": "keep", "timestamp": 1788424760558}
{"bestDirection": "higher", "maxIterations": 4, "metricName": "metrics_clone_per_second", "metricUnit": "clones/s", "name": "Share the metrics aggregate behind one reference", "timestamp": 1788424820736, "type": "config"}
