{"bestDirection": "higher", "maxIterations": 8, "metricName": "bytestream_read_mebibytes_per_second", "metricUnit": "MiB/s", "name": "Optimize Kura bounded-resource throughput", "timestamp": 1788379277200, "type": "config"}
{"asi": {"baseline_mib_s": 17599.189, "finding": "ReaderStream plus Bytes::to_vec performs an avoidable full-chunk copy"}, "commit": "402303d", "confidence": null, "description": "benchmark(kura): establish ByteStream read materialization baseline", "metric": 17599.189, "metrics": {}, "run": 1, "segment": 0, "status": "keep", "timestamp": 1788380442550}
{"asi": {"action": "compare original and candidate implementations interleaved in one process", "finding": "absolute host throughput varies heavily under shared compile load"}, "commit": "bc3a2ff", "confidence": null, "description": "benchmark(kura): lengthen ByteStream materialization samples", "metric": 16631.289, "metrics": {}, "run": 2, "segment": 0, "status": "keep", "timestamp": 1788381141054}
{"bestDirection": "higher", "maxIterations": 8, "metricName": "bytestream_read_speedup_ratio", "metricUnit": "x", "name": "Optimize Kura ByteStream buffer ownership", "timestamp": 1788381176694, "type": "config"}
{"asi": {"calibration_max": 1.066943, "calibration_min": 0.93361, "constraint": "candidate gain must exceed identical-function timing bias; pointer identity will prove copy removal"}, "commit": "dfc1fdd", "confidence": null, "description": "benchmark(kura): compare ByteStream ownership paths in process", "metric": 0.93361, "metrics": {"baseline_mebibytes_per_second": 11646.116, "candidate_mebibytes_per_second": 11811.026}, "run": 3, "segment": 1, "status": "keep", "timestamp": 1788381454026}
{"asi": {"cause": "futures try_unfold stream is not Unpin", "fix": "pin the stream in the pointer-identity test before calling next"}, "commit": "dfc1fdd", "confidence": null, "description": "Direct vector stream ownership test required pinning", "metric": 0.0, "metrics": {"baseline_mebibytes_per_second": 0.0, "candidate_mebibytes_per_second": 0.0}, "run": 4, "segment": 1, "status": "crash", "timestamp": 1788381540372}
{"asi": {"memory": "one fewer 512 KiB live buffer per active ByteStream read", "result": "direct response vector owns the reader-filled allocation", "speedup_confirmation": 4.389309, "speedup_first": 2.747193}, "commit": "e03caa9", "confidence": null, "description": "perf(kura): remove ByteStream read chunk copy", "metric": 4.389309, "metrics": {"baseline_mebibytes_per_second": 12238.133, "candidate_mebibytes_per_second": 55324.967}, "run": 5, "segment": 1, "status": "keep", "timestamp": 1788381815213}
{"asi": {"copies_removed": ["ByteStream metadata map", "ByteStream admission guard", "per-chunk resource name", "authorization key and hash", "batch digest vectors", "missing and response digests", "batch upload data ownership"], "validation": ["bytestream_write", "cas_batch_transfers_record_grpc_usage_events", "action_cache_transfers_record_grpc_usage_events", "find_missing_blobs_treats_the_empty_blob_as_present"]}, "commit": "7b6f1e1", "confidence": 45.59139063447609, "description": "perf(kura): move decoded Remote Execution request data", "metric": 4.466806, "metrics": {"baseline_mebibytes_per_second": 15012.402, "candidate_mebibytes_per_second": 65791.843}, "run": 6, "segment": 1, "status": "keep", "timestamp": 1788382111758}
{"asi": {"allocations": "two per accelerated request to one per accelerated connection", "buffer_bound_bytes": 16384, "validation": ["request_peek_and_consumption_reuse_the_connection_buffer", "an_accelerated_", "accelerator_sends_retryable_error_before_success_when_memory_is_exhausted"]}, "commit": "53ab3f0", "confidence": 13.923069491741765, "description": "perf(kura): reuse accelerated request header buffer", "metric": 4.968975, "metrics": {"baseline_mebibytes_per_second": 15949.245, "candidate_mebibytes_per_second": 72646.87}, "run": 7, "segment": 1, "status": "keep", "timestamp": 1788382297568}
{"asi": {"admission": "three live buffers after direct response-vector fill", "concurrency_increase_percent": 33.333, "memory_reduction_percent": 25, "validation": ["exact route reservation", "transport permit lifetime", "paired benchmark", "focused ownership checks"]}, "commit": "000021d", "confidence": 6.961534745870893, "description": "perf(kura): reclaim ByteStream admission capacity", "metric": 3.470103, "metrics": {"baseline_mebibytes_per_second": 14037.166, "candidate_mebibytes_per_second": 48489.488}, "run": 8, "segment": 1, "status": "keep", "timestamp": 1788382746153}
{"bestDirection": "higher", "maxIterations": 10, "metricName": "segment_reader_owned_speedup_ratio", "metricUnit": "x", "name": "Optimize Kura owned segment reads", "timestamp": 1788383568331, "type": "config"}
{"asi": {"concurrency_increase_percent": 33.333, "copies_removed": "one full segment chunk per streamed response", "memory_reduction_percent": 25, "validation": ["disk-backed ranged correctness", "paired disk benchmark", "focused owned-chunk checks"]}, "commit": "554169c", "confidence": null, "description": "perf(kura): move owned segment chunks into response streams", "metric": 1.418606, "metrics": {"baseline_mebibytes_per_second": 2802.041, "candidate_mebibytes_per_second": 5423.013}, "run": 9, "segment": 2, "status": "keep", "timestamp": 1788384089845}
{"bestDirection": "higher", "maxIterations": 10, "metricName": "segment_read_uninitialized_speedup_ratio", "metricUnit": "x", "name": "Optimize Kura segment buffer initialization", "timestamp": 1788384120579, "type": "config"}
{"asi": {"application_unsafe_blocks": 0, "chunk_bound_bytes": 524288, "initialization": "operating system initializes vector spare capacity", "validation": ["disk-backed ranged correctness", "paired positional-read benchmark"]}, "commit": "b924aef", "confidence": null, "description": "perf(kura): avoid zeroing segment read buffers", "metric": 1.15999, "metrics": {"baseline_mebibytes_per_second": 14908.478, "candidate_mebibytes_per_second": 17342.582}, "run": 10, "segment": 3, "status": "keep", "timestamp": 1788384274480}
{"bestDirection": "higher", "maxIterations": 10, "metricName": "replication_upload_stream_speedup_ratio", "metricUnit": "x", "name": "Optimize Kura replication upload reads", "timestamp": 1788384337959, "type": "config"}
{"asi": {"chunk_bound_bytes": 524288, "copies_removed": "one full segment chunk per replication request-body chunk", "validation": ["stall-window rearm", "paired replication body-stream benchmark"]}, "commit": "8e228cb", "confidence": null, "description": "perf(kura): stream owned chunks into replication uploads", "metric": 1.214831, "metrics": {"baseline_mebibytes_per_second": 9818.359, "candidate_mebibytes_per_second": 11651.436}, "run": 11, "segment": 4, "status": "keep", "timestamp": 1788384497051}
{"bestDirection": "higher", "maxIterations": 10, "metricName": "backfill_spool_owned_speedup_ratio", "metricUnit": "x", "name": "Optimize Kura backfill spooling reads", "timestamp": 1788384573439, "type": "config"}
{"asi": {"chunk_bound_bytes": 524288, "copies_removed": "one full segment chunk per backfill spool write", "validation": ["byte-for-byte spool file", "exact copied length", "paired reader-to-writer benchmark"]}, "commit": "cf786a7", "confidence": null, "description": "perf(kura): write owned chunks into backfill spools", "metric": 1.215781, "metrics": {"baseline_mebibytes_per_second": 10062.16, "candidate_mebibytes_per_second": 12233.378}, "run": 12, "segment": 5, "status": "keep", "timestamp": 1788384710381}
{"bestDirection": "higher", "maxIterations": 10, "metricName": "backfill_spool_response_speedup_ratio", "metricUnit": "x", "name": "Optimize Kura backfill spool responses", "timestamp": 1788384722773, "type": "config"}
{"asi": {"concurrency_increase_percent": 33.333, "copies_removed": "one full chunk per backfill spool response chunk", "memory_reduction_percent": 25, "validation": ["spool cleanup lifetime", "paired spool-response benchmark"]}, "commit": "87d78c0", "confidence": null, "description": "perf(kura): stream owned chunks from backfill spools", "metric": 1.232758, "metrics": {"baseline_mebibytes_per_second": 10468.662, "candidate_mebibytes_per_second": 12729.602}, "run": 13, "segment": 6, "status": "keep", "timestamp": 1788384864951}
{"bestDirection": "higher", "maxIterations": 10, "metricName": "inline_bytes_stream_speedup_ratio", "metricUnit": "x", "name": "Optimize Kura inline artifact streaming", "timestamp": 1788384898203, "type": "config"}
{"asi": {"copies_removed": "all per-chunk copies for inline byte-stream consumers", "inline_transport_buffer_count": 2, "pointer_identity": true, "validation": ["source allocation pointer identity", "synthetic paired materialization benchmark"]}, "commit": "62a6c98", "confidence": null, "description": "perf(kura): stream inline artifacts without copies", "metric": 360.780702, "metrics": {"baseline_mebibytes_per_second": 49794.549, "candidate_mebibytes_per_second": 17964912.281}, "run": 14, "segment": 7, "status": "keep", "timestamp": 1788385147490}
{"bestDirection": "lower", "maxIterations": 10, "metricName": "blocking dispatch share of 3 Gbit wire budget", "metricUnit": "percent", "name": "Measure Kura blocking read dispatch", "timestamp": 1788385480983, "type": "config"}
{"asi": {"decision": "keep Tokio; runtime replacement not justified", "production_egress_gigabits_per_second": 3, "validation": ["three paced concurrent benchmark runs", "format check"]}, "commit": "f9da935576", "confidence": null, "description": "perf(kura): measure blocking read dispatch", "metric": 3.129, "metrics": {"dispatch_p95_median_microseconds": 43.75, "read_p95_median_microseconds": 92.625, "streams": 32.0, "wire_chunk_budget_microseconds": 1398.101}, "run": 15, "segment": 8, "status": "keep", "timestamp": 1788385664825}
{"bestDirection": "higher", "maxIterations": 10, "metricName": "whole artifact read speedup", "metricUnit": "x", "name": "Remove Kura whole-read buffer initialization", "timestamp": 1788385689630, "type": "config"}
{"asi": {"additional_memory_bytes": 0, "copies_removed": "one complete zero-fill pass per materialized file artifact", "unsafe_application_code": false, "validation": ["three paired benchmark runs", "exact range test", "truncation test", "format check"]}, "commit": "ff8d5738dc", "confidence": null, "description": "perf(kura): skip whole-read buffer zeroing", "metric": 1.099118, "metrics": {"baseline_mebibytes_per_second": 14180.141, "candidate_mebibytes_per_second": 15508.376, "sample_bytes": 536870912.0}, "run": 16, "segment": 9, "status": "keep", "timestamp": 1788385948461}
{"bestDirection": "higher", "maxIterations": 10, "metricName": "accelerated setup speedup", "metricUnit": "x", "name": "Trim Kura accelerated request ownership", "timestamp": 1788386036679, "type": "config"}
{"asi": {"authorization_context_skipped_when_disabled": true, "copies_removed": ["file handle reference increment", "configured tenant string", "namespace string", "analytics key string", "content type string"], "pointer_identity": true, "validation": ["three paired benchmark runs", "pointer identity test", "content type sanitization test", "capacity shed socket test", "format check"]}, "commit": "9c7426acc4", "confidence": null, "description": "perf(kura): move accelerated transfer metadata", "metric": 1.386563, "metrics": {"iterations_per_sample": 200000.0, "setup_speedup_run_1": 1.389168, "setup_speedup_run_2": 1.30109, "setup_speedup_run_3": 1.386563}, "run": 17, "segment": 10, "status": "keep", "timestamp": 1788386737772}
{"bestDirection": "higher", "maxIterations": 10, "metricName": "HTTP metric label speedup", "metricUnit": "x", "name": "Remove Kura metric route clones", "timestamp": 1788386806579, "type": "config"}
{"asi": {"accelerated_route_allocations_removed_per_response": 2, "cardinality_changed": false, "dynamic_public_route_clones_removed_per_response": 1, "validation": ["three paired benchmark runs", "internal route metric test", "rendered metrics test", "format check"]}, "commit": "556c2ad6db", "confidence": null, "description": "perf(kura): avoid HTTP metric route clones", "metric": 2.314626, "metrics": {"iterations_per_sample": 1000000.0, "speedup_run_1": 2.314626, "speedup_run_2": 2.321335, "speedup_run_3": 2.286898}, "run": 18, "segment": 11, "status": "keep", "timestamp": 1788387134941}
{"bestDirection": "higher", "maxIterations": 10, "metricName": "existence cache hit speedup", "metricUnit": "x", "name": "Share Kura cache ordering keys", "timestamp": 1788387193866, "type": "config"}
{"asi": {"cache_hit_string_allocations_removed": 1, "existence_key_allocations_per_entry_after": 1, "existence_key_allocations_per_entry_before": 2, "manifest_artifact_id_copies_after": 2, "manifest_artifact_id_copies_before": 3, "validation": ["three paired benchmark runs", "expiration tests", "eviction-order tests", "manifest byte-bound test", "handle-cache eviction tests", "format check"]}, "commit": "678a79fa01", "confidence": null, "description": "perf(kura): share cache ordering keys", "metric": 1.119967, "metrics": {"iterations_per_sample": 500000.0, "speedup_run_1": 1.11383, "speedup_run_2": 1.131098, "speedup_run_3": 1.119967}, "run": 19, "segment": 12, "status": "keep", "timestamp": 1788387457597}
{"bestDirection": "higher", "maxIterations": 8, "metricName": "request_accounting_requests_per_second", "metricUnit": "requests_per_second", "name": "Optimize Kura request accounting synchronization", "timestamp": 1788387952705, "type": "config"}
{"asi": {"finding": "request arrivals and steady-state completions both invoke shared shutdown notification machinery", "requests_per_worker": 50000, "workers": 8}, "commit": "04896f3", "confidence": null, "description": "test(kura): benchmark request accounting synchronization", "metric": 279259.648, "metrics": {}, "run": 20, "segment": 13, "status": "keep", "timestamp": 1788388086471}
{"asi": {"baseline_requests_per_second": 279259.648, "candidate_requests_per_second": 360105.299, "notifications_removed": "all arrivals and non-draining completions", "speedup_percent": 28.954, "validation": ["inflight accounting", "draining completion wake-up", "shutdown drain completion and timeout"]}, "commit": "970c5f4", "confidence": null, "description": "perf(kura): avoid steady-state drain notifications", "metric": 360105.299, "metrics": {}, "run": 21, "segment": 13, "status": "keep", "timestamp": 1788388216719}
{"asi": {"candidate_requests_per_second": 4643989.77, "contention_removed": "reference-count updates across the complete metrics registry", "original_baseline_speedup_ratio": 16.629, "previous_requests_per_second": 360105.299, "retained_observability": ["total http in-flight", "public http in-flight", "remote procedure call in-flight"], "speedup_ratio": 12.896}, "commit": "f580163", "confidence": 53.988434356227756, "description": "perf(kura): narrow in-flight metrics ownership", "metric": 4643989.77, "metrics": {}, "run": 22, "segment": 13, "status": "keep", "timestamp": 1788388356850}
{"asi": {"best_kept_requests_per_second": 4643989.77, "candidate_runs": [3672917.513, 3835849.611], "decision": "keep the simpler compact metrics handle", "finding": "removing the second shared ownership increment did not offset the added runtime-state coupling and access pattern"}, "commit": "f580163", "confidence": 2.4544466286005764, "description": "Store in-flight gauges on runtime state", "metric": 3835849.611, "metrics": {}, "run": 23, "segment": 13, "status": "discard", "timestamp": 1788388514611}
{"asi": {"atomic_updates": "two to one on public request arrival and completion", "candidate_runs": [5222378.062, 7155864.46], "conservative_speedup_percent": 12.455, "count_bits_each": 32, "previous_requests_per_second": 4643989.77, "validation": ["total request count", "public request count", "background exclusion", "shutdown drain"]}, "commit": "2017a0f", "confidence": 2.071257245753361, "description": "perf(kura): combine in-flight request counters", "metric": 7155864.46, "metrics": {}, "run": 24, "segment": 13, "status": "keep", "timestamp": 1788388668220}
{"bestDirection": "higher", "maxIterations": 8, "metricName": "manifest_cache_lookups_per_second", "metricUnit": "lookups_per_second", "name": "Optimize Kura manifest cache lock duration", "timestamp": 1788389032972, "type": "config"}
{"asi": {"artifact": "one hot cached manifest", "finding": "all owned manifest strings clone while the global cache lock is held", "lookups_per_worker": 50000, "workers": 8}, "commit": "8ba603c", "confidence": null, "description": "test(kura): benchmark manifest cache contention", "metric": 1423779.733, "metrics": {}, "run": 25, "segment": 14, "status": "keep", "timestamp": 1788389118845}
{"bestDirection": "higher", "maxIterations": 6, "metricName": "manifest_cache_hit_speedup_ratio", "metricUnit": "x", "name": "Compare Kura manifest cache lock duration", "timestamp": 1788389250475, "type": "config"}
{"asi": {"baseline_lookups_per_second": 1241310.343, "candidate_lookups_per_second": 1413858.884, "clone_scope": "owned manifest strings after unlock", "lock_scope": "lookup and recency only", "memory_accounting": "two shared-reference counters added", "paired_speedup_runs": [1.12604, 1.140262], "validation": ["pointer identity", "manifest byte budget", "least-recently-used eviction"]}, "commit": "f20adb3", "confidence": null, "description": "perf(kura): shorten manifest cache lock holds", "metric": 1.140262, "metrics": {"baseline_lookups_per_second": 1241310.343, "candidate_lookups_per_second": 1413858.884}, "run": 26, "segment": 15, "status": "keep", "timestamp": 1788389349887}
{"bestDirection": "higher", "maxIterations": 8, "metricName": "segment_handle_cache_lookups_per_second", "metricUnit": "lookups_per_second", "name": "Optimize Kura hot segment handle access", "timestamp": 1788389411375, "type": "config"}
{"asi": {"baseline_lookups_per_second": 2712133.322, "fixture_guard": "outside-root file correctly rejected before fixture moved under data directory", "lookups_per_worker": 50000, "workers": 8, "workload": "repeated access to one open persistent file handle"}, "commit": "7bf9e21", "confidence": null, "description": "test(kura): benchmark hot segment handle access", "metric": 2712133.322, "metrics": {}, "run": 27, "segment": 16, "status": "keep", "timestamp": 1788389580867}
{"asi": {"atomic_pointer_minimum_version": "1.9.1", "baseline_lookups_per_second": 2712133.322, "candidate_lookups_per_second_runs": [31094326.739, 36970712.264], "fast_path_entries": 1, "minimum_speedup_ratio": 11.464, "resource_bound": "hot entry aliases a handle retained by the bounded cache", "validation": ["exact recency", "capacity-two eviction", "trim clears front", "remove clears front", "zero capacity retains no front"]}, "commit": "5b8475a", "confidence": null, "description": "perf(kura): bypass repeated handle cache locks", "metric": 36970712.264, "metrics": {}, "run": 28, "segment": 16, "status": "keep", "timestamp": 1788390063941}
{"asi": {"bounded_candidate_entries": 1, "confirmed_alternating_speedup_ratios": [1.587395, 1.542646], "confirmed_hot_speedup_ratio": 14.775, "initial_alternating_speedup_ratio": 0.331165, "original_hot_baseline_lookups_per_second": 2712133.322, "promotion_misses": 64, "reason": "amortize atomic publication under mixed-key traffic"}, "commit": "d62bbcd", "confidence": 12.05026547860938, "description": "perf(kura): stabilize hot handle promotion", "metric": 40070961.666, "metrics": {"alternating_baseline_lookups_per_second": 4226553.853, "alternating_candidate_lookups_per_second": 6531185.39, "alternating_speedup_ratio": 1.542646}, "run": 29, "segment": 16, "status": "keep", "timestamp": 1788390458347}
{"bestDirection": "higher", "maxIterations": 6, "metricName": "response_stream_admissions_per_second", "metricUnit": "admissions_per_second", "name": "Optimize Kura response stream admission synchronization", "timestamp": 1788390746742, "type": "config"}
{"asi": {"admissions_per_worker": 50000, "baseline_notification": "every completed response stream wakes the shared notification", "workers": 8, "workload": "uncontended acquire and release with no queued waiters"}, "commit": "75fc835", "confidence": null, "description": "test(kura): benchmark response stream admission", "metric": 397862.55, "metrics": {}, "run": 30, "segment": 17, "status": "keep", "timestamp": 1788390901237}
{"asi": {"admissions_per_worker": 50000, "paired_speedup_runs": [1.009319, 1.039476, 1.005999], "removed": "unconditional notification and one shared-reference clone per release", "resource_bounds": "unchanged", "safety": "sequentially consistent waiter registration plus queued handoff test", "workers": 8}, "commit": "cc0a37e", "confidence": null, "description": "perf(kura): skip idle response wakeups", "metric": 1.009319, "metrics": {"baseline_admissions_per_second": 333740.392, "candidate_admissions_per_second": 336850.533}, "run": 31, "segment": 17, "status": "keep", "timestamp": 1788391358077}
{"asi":{"baseline_writes_per_second":119.43,"candidate_writes_per_second":226.22,"concurrency":64,"durability":"segment data and metadata durable before acknowledgment","objects":5000,"p50_ms":{"baseline":439,"candidate":244},"p95_ms":{"baseline":1039,"candidate":519},"p99_ms":{"baseline":1334,"candidate":668},"resource_bounds":"unchanged"},"commit":"working-tree","confidence":null,"description":"perf(kura): coalesce durable segment and metadata barriers","metric":226.22,"metrics":{"speedup_ratio":1.894},"run":32,"segment":18,"status":"keep","timestamp":1788403017000}
