{"asi": {"bounded_resources": "The wrapper replaces the existing aggregate value with one fixed allocation at startup. It does not add per-request state, change metric cardinality, or alter any memory, stream, disk, or concurrency cap.", "safety": "All metric objects remain the same thread-safe counters, gauges, histograms, and families. The wrapper is immutable after construction; the size test proves Metrics is one shared reference, and the full metric rendering test passed.", "summary": "Metrics is now one cloneable shared reference around its immutable aggregate, so stream trackers and background handoffs no longer clone every metric-family handle.", "validation": "Clone throughput rose from at most 2.531 million to at least 182.115 million per second, a conservative 71.95x speedup. Repeated 500000-request HTTP read samples were within noise at 77775.51 versus 77279.19 reads per second with zero failures and matching median and tail latency."}, "commit": "13598c5", "confidence": null, "description": "perf(kura): share metrics behind one handle", "metric": 182114830.321, "metrics": {"baseline_http_reads_per_second": 77775.51, "baseline_max_clones_per_second": 2531004.809, "candidate_http_reads_per_second": 77279.19, "candidate_min_clones_per_second": 182114830.321, "http_failed_requests": 0.0, "http_ratio": 0.993618, "http_requests_per_sample": 500000.0, "minimum_speedup_ratio": 71.953568}, "run": 52, "segment": 32, "status": "keep", "timestamp": 1788425230725}
{"bestDirection": "higher", "maxIterations": 4, "metricName": "reapi_metadata_latency_speedup_ratio", "metricUnit": "x", "name": "Cache fixed REAPI latency metric handles", "timestamp": 1788425270599, "type": "config"}
{"asi": {"bounded_resources": "Each metadata method adds one empty OnceLock and creates its existing histogram series only if used. No unused series are allocated, route cardinality remains fixed, and request, memory, disk, and concurrency bounds are unchanged.", "safety": "Unknown routes retain the owned-label fallback. A focused test verifies the original rendered series and the accounting test verifies every known route is borrowed.", "summary": "All ten fixed remote-execution protocol routes now borrow static route names. The eight metadata methods resolve their latency histogram lazily once and then update it directly, matching the existing ByteStream fast paths.", "validation": "Two paired runs improved warm metadata latency observation by 7.924174x and 8.259050x."}, "commit": "af5413f", "confidence": null, "description": "perf(kura): cache fixed protocol latency metrics", "metric": 7.924174, "metrics": {"eager_additional_series": 0.0, "known_routes": 10.0, "maximum_baseline_observations_per_second": 16772637.307, "maximum_paired_speedup_ratio": 8.25905, "minimum_candidate_observations_per_second": 130807321.861, "minimum_paired_speedup_ratio": 7.924174}, "run": 53, "segment": 33, "status": "keep", "timestamp": 1788425403366}
{"bestDirection": "higher", "metricName": "connection_sharding_speedup_ratio", "metricUnit": "x", "name": "Measure bounded ByteStream connection sharding", "timestamp": 1788426580838, "type": "config"}
{"asi": {"failure": "ResourceExhausted before measurement", "finding": "The default 512 MiB test runtime intentionally cannot admit 512 simultaneous 256 KiB ByteStream responses plus bounded transport ownership", "next": "Repeat with a fixed 4 GiB runtime budget matching high-concurrency production sizing; do not raise any product default"}, "commit": "5271ad4", "confidence": null, "description": "Connection sharding benchmark exceeded the test fixture response-admission budget at concurrency 512", "metric": 0.0, "metrics": {}, "run": 54, "segment": 34, "status": "crash", "timestamp": 1788426724332}
{"asi": {"confirmation_matrix": {"connections_1_rps": 4315.81, "connections_2_rps": 8552.426, "connections_4_rps": 10495.257, "connections_8_rps": 8489.178}, "first_matrix": {"connections_1_rps": 6051.844, "connections_2_rps": 9478.442, "connections_4_rps": 10278.984, "connections_8_rps": 10618.391}, "four_connection_speedups": [1.6985, 2.4318], "safety": "The default 512 MiB fixture rejected overload before measurement; a fixed benchmark-only budget was required and no production limit changed", "stable_choice": "four connections", "workload": {"blob_kibibytes": 256, "order": "alternating", "payload_validation": "exact", "requests_per_sample": 10000, "runtime_budget_gibibytes": 4, "samples": 3, "total_concurrency": 512}}, "commit": "5271ad4", "confidence": null, "description": "test(kura): benchmark bounded connection sharding", "metric": 2.431816, "metrics": {"connections_1_p50_us": 105626.0, "connections_1_p95_us": 207136.0, "connections_1_p99_us": 288439.0, "connections_1_requests_per_second": 4315.81, "connections_2_p50_us": 50363.0, "connections_2_p95_us": 99193.0, "connections_2_p99_us": 132200.0, "connections_2_requests_per_second": 8552.426, "connections_4_p50_us": 41199.0, "connections_4_p95_us": 81149.0, "connections_4_p99_us": 105275.0, "connections_4_requests_per_second": 10495.257, "connections_8_p50_us": 36547.0, "connections_8_p95_us": 88829.0, "connections_8_p99_us": 123132.0, "connections_8_requests_per_second": 8489.178}, "run": 55, "segment": 34, "status": "keep", "timestamp": 1788427306596}
{"bestDirection": "higher", "maxIterations": 4, "metricName": "positioned_segment_write_speedup_ratio", "metricUnit": "x", "name": "Parallelize bounded durable segment writes", "timestamp": 1788427598756, "type": "config"}
{"asi": {"bounded_resources": "The existing foreground preload reservation still charges every byte. A fixed 32-permit semaphore bounds simultaneous blocking file writes. Memory-pressure and file-cache-dropping paths retain the serial streaming writer and its periodic cache reclamation.", "safety": "An exclusive segment barrier prevents rotation or synchronization while a positioned range is in progress. A writer publishes its durability sequence only after its complete range is written, and metadata is still committed only after segment synchronization. Concurrent exact-byte reads and non-overlapping ranges are covered by tests.", "summary": "Small preloaded writes now reserve non-overlapping offsets while briefly holding the segment mutex, then issue bounded positioned writes concurrently.", "validation": "Three strengthened paired append runs improved by 1.17 to 1.79 times with equivalent physical synchronization counts. Two paired complete artifact-store runs improved throughput by 5.4 and 7.8 percent while reducing median, 95th-percentile, and 99th-percentile latency. Compilation, formatting, positioned-write checks, and concurrent durability checks passed."}, "commit": "5bb3237", "confidence": null, "description": "perf(kura): parallelize bounded segment writes", "metric": 1.169774, "metrics": {"maximum_artifact_speedup_ratio": 1.077654, "maximum_confirmed_segment_speedup_ratio": 1.791602, "minimum_artifact_speedup_ratio": 1.05445, "minimum_confirmed_segment_speedup_ratio": 1.169774, "positioned_artifact_p50_microseconds": 26157.0, "positioned_artifact_p95_microseconds": 64735.0, "positioned_artifact_p99_microseconds": 83730.0, "positioned_artifact_writes_per_second": 1747.521, "positioned_segment_fsyncs": 8.0, "positioned_segment_writes_per_second": 1743.723, "serialized_artifact_p50_microseconds": 33289.0, "serialized_artifact_p95_microseconds": 76020.0, "serialized_artifact_p99_microseconds": 95551.0, "serialized_artifact_writes_per_second": 1621.597, "serialized_segment_fsyncs": 8.0, "serialized_segment_writes_per_second": 1340.606}, "run": 56, "segment": 35, "status": "keep", "timestamp": 1788428463927}
{"bestDirection": "higher", "maxIterations": 4, "metricName": "positioned_artifact_writes_per_second", "metricUnit": "writes/s", "name": "Pipeline ordered RocksDB writes", "timestamp": 1788428699748, "type": "config"}
{"asi": {"finding": "RocksDB already groups concurrent write batches. Splitting its log and memory-table queues did not produce a repeatable complete-store throughput gain on this workload and made positioned writes slower than the serialized control within both candidate runs.", "next": "Retain the default ordered write queue and avoid adding a redundant Kura metadata coordinator.", "safety": "The experiment changed only an established RocksDB ordering-preserving option, but an unproven operational mode is not justified without a clear measured benefit."}, "commit": "bd7303b", "confidence": null, "description": "RocksDB pipelined writes stayed within host noise and worsened paired positioned-write results", "metric": 1463.348, "metrics": {"baseline_positioned_max_writes_per_second": 1564.512, "baseline_positioned_min_writes_per_second": 1369.866, "candidate_paired_speedup_max": 0.920406, "candidate_paired_speedup_min": 0.875802, "candidate_positioned_max_writes_per_second": 1540.675, "candidate_positioned_min_writes_per_second": 1463.348}, "run": 57, "segment": 36, "status": "discard", "timestamp": 1788428794276}
{"bestDirection": "higher", "maxIterations": 4, "metricName": "positioned_artifact_write_speedup_ratio", "metricUnit": "x", "name": "Tune bounded positioned write concurrency", "timestamp": 1788428817713, "type": "config"}
{"asi": {"bounded_resources": "Retain the existing fixed ceiling of 32 positioned writes because it is the smallest measured limit that produced repeatable complete-store gains while keeping concurrent blocking work tightly capped.", "finding": "Eight and sixteen permits consistently underfilled the storage path. Sixty-four permits improved one heavily contended run but did not repeat the gain and doubles the maximum blocking scheduler and disk pressure.", "next": "Stop tuning this cap on a shared development host; validate the retained limit on production-shaped Linux hardware before making it configurable."}, "commit": "0aeeb64", "confidence": null, "description": "Smaller write caps regressed and sixty-four permits did not repeat its first gain", "metric": 0.968548, "metrics": {"eight_slot_speedup_ratio": 0.925562, "retained_slots": 32.0, "sixteen_slot_speedup_ratio": 0.966301, "sixty_four_slot_confirmation_speedup_ratio": 0.968548, "sixty_four_slot_first_speedup_ratio": 1.26826}, "run": 58, "segment": 37, "status": "discard", "timestamp": 1788429167130}
{"bestDirection": "higher", "maxIterations": 4, "metricName": "direct_memory_artifact_write_speedup_ratio", "metricUnit": "x", "name": "Eliminate redundant in-memory artifact staging", "timestamp": 1788430176142, "type": "config"}
{"asi": {"bounded_resources": "The payload was already fully admitted and allocated before this store call. Direct persistence removes temporary-disk reservation and source page-cache occupancy, adds no queue or buffer, and retains the fixed 32-write ceiling plus the cache-reclaiming serial fallback.", "safety": "File-backed and memory-backed sources share the same namespace and per-artifact locks, precheck, segment durability barrier, metadata commit, outbox reservation, and eviction path. The concurrent restart test exercises the direct path and passed.", "summary": "Payloads already materialized by bounded Remote Execution batch decoding now enter the existing segment writer directly instead of being written to and reread from a temporary file.", "validation": "Two paired complete-store runs improved throughput by 31.2 and 32.6 percent. Median latency fell from 32.0 to 18.2 milliseconds and from 36.4 to 22.5 milliseconds; 99th-percentile latency fell from 104.7 to 81.8 milliseconds and from 106.9 to 72.2 milliseconds."}, "commit": "796e6d7", "confidence": null, "description": "perf(kura): persist admitted artifact bytes directly", "metric": 1.326038, "metrics": {"direct_memory_artifact_write_p50_microseconds": 22458.0, "direct_memory_artifact_write_p95_microseconds": 61149.0, "direct_memory_artifact_write_p99_microseconds": 72204.0, "direct_memory_artifact_writes_per_second": 1952.433, "staged_artifact_write_p50_microseconds": 36381.0, "staged_artifact_write_p95_microseconds": 79079.0, "staged_artifact_write_p99_microseconds": 106881.0, "staged_artifact_writes_per_second": 1445.611}, "run": 59, "segment": 38, "status": "keep", "timestamp": 1788430321775}
{"bestDirection": "higher", "maxIterations": 4, "metricName": "direct_memory_bytestream_write_speedup_ratio", "metricUnit": "x", "name": "Keep small ByteStream uploads in admitted memory", "timestamp": 1788430909769, "type": "config"}
{"asi": {"bounded_resources": "The direct buffer replaces temporary-file source pages and is covered by the existing source-plus-destination permit. Allocation failure, oversized uploads, deferred durability, and non-memory sources keep the serial bounded fallback. Positioned writes remain capped at 32 and are limited to 256 kibibytes.", "safety": "The segment durability barrier completes before page-cache advice, metadata still follows durable bytes, and advice covers only page-aligned full pages inside the writer range. Mixed concurrent file and bounded-memory writes were verified byte-for-byte before and after reopening the store; large fallback, pressure rejection, usage, formatting, compilation, and Clippy checks passed.", "summary": "Small ByteStream uploads accumulate in one fallibly allocated buffer inside their existing admission reservation and enter the direct segment path. Positioned writers under overlapping cache-reclaiming policy release only their own synchronized range before metadata publication.", "validation": "Two confirmed end-to-end ByteStream comparisons improved durable throughput by 2.117966 and 1.589157 times. Median latency fell from 95.0 to 42.1 milliseconds and from 71.4 to 39.0 milliseconds; 99th-percentile latency fell from 201.1 to 136.6 milliseconds and from 185.6 to 116.9 milliseconds."}, "commit": "c9e3fb8", "confidence": null, "description": "perf(kura): bypass staging for small admitted uploads", "metric": 1.589157, "metrics": {"direct_memory_bytestream_write_p50_microseconds": 38990.0, "direct_memory_bytestream_write_p95_microseconds": 92008.0, "direct_memory_bytestream_write_p99_microseconds": 116861.0, "direct_memory_bytestream_writes_per_second": 1224.696, "staged_bytestream_write_p50_microseconds": 71386.0, "staged_bytestream_write_p95_microseconds": 137200.0, "staged_bytestream_write_p99_microseconds": 185553.0, "staged_bytestream_writes_per_second": 754.543}, "run": 60, "segment": 39, "status": "keep", "timestamp": 1788431566097}
{"bestDirection": "higher", "maxIterations": 5, "metricName": "auth_cache_hit_speedup_ratio", "metricUnit": "x", "name": "Remove authorization cache-hit allocation and lock overhead", "timestamp": 1788431750860, "type": "config"}
{"asi": {"bounded_resources": "The change adds a constant fifteen shared metric handles per registry and removes transient allocation from every hit. Cache capacities and all request, memory, and disk admission limits remain unchanged.", "safety": "The handles belong to the same registered families and exact label sets. Unknown labels retain the previous family lookup path, and focused rendering verifies identical series and counts.", "summary": "Authorization cache hits update fixed metric handles resolved at startup instead of allocating labels and acquiring three metric-family read locks per request.", "validation": "Two eight-worker paired runs improved complete cache-hit accounting by 17.973092 and 20.948665 times. Formatting and focused metric tests passed."}, "commit": "39cc5e5a9c", "confidence": null, "description": "perf(kura): pre-resolve authorization metrics", "metric": 17.973092, "metrics": {"baseline_max_observations_per_second": 3057967.012, "baseline_min_observations_per_second": 2441138.184, "candidate_max_observations_per_second": 56095735.675, "candidate_min_observations_per_second": 54064222.511, "maximum_paired_speedup_ratio": 20.948665, "minimum_paired_speedup_ratio": 17.973092}, "run": 61, "segment": 40, "status": "keep", "timestamp": 1788432140070}
{"bestDirection": "higher", "maxIterations": 5, "metricName": "auth_cache_lookup_speedup_ratio", "metricUnit": "x", "name": "Minimize authorization key and cache-hit work", "timestamp": 1788432144949, "type": "config"}
{"asi": {"bounded_resources": "Every cache retains its configured maximum entry count and expiration policy. Fixed 32-byte credential keys replace 64-byte hexadecimal strings, and request contexts retain only one authorization value rather than all headers.", "safety": "Revocation lookup still runs after every entry lookup with the same ordering. The cache variants share Moka locking, expiration, immediate visibility, and bounded eviction semantics. Focused policy and transport authorization tests passed.", "summary": "Authorization hits borrow the credential, hash its raw bytes into a fixed binary key, and use synchronous concurrent caches for entries and revocations. Backend consultations retain asynchronous per-key coalescing.", "validation": "Three eight-worker paired runs improved the complete former key-and-two-cache hit path by 1.238488, 1.275074, and 1.277841 times before the borrowed-key follow-up."}, "commit": "6bfd9e30cd", "confidence": null, "description": "Use typed synchronous authorization hit caches", "metric": 1.238488, "metrics": {"baseline_max_lookups_per_second": 1523048.484, "candidate_max_lookups_per_second": 2019868.778, "maximum_paired_speedup_ratio": 1.318, "minimum_paired_speedup_ratio": 1.238488}, "run": 62, "segment": 41, "status": "keep", "timestamp": 1788433529828}
{"bestDirection": "higher", "maxIterations": 3, "metricName": "borrowed_entry_key_speedup_ratio", "metricUnit": "x", "name": "Avoid owned authorization entry keys on hits", "timestamp": 1788433535653, "type": "config"}
{"asi": {"finding": "Avoiding the owned target-key allocation did not improve the concurrent lookup rate. Two paired runs were effectively equal, with one slightly slower.", "next": "Keep the simpler typed owned key and synchronous bounded caches.", "safety": "Do not retain the extra Equivalent implementation or direct dependency when they provide no measured benefit."}, "commit": "6bfd9e30cd", "confidence": null, "description": "Borrowed entry keys stayed within noise", "metric": 0.993791, "metrics": {"borrowed_entry_key_lookups_per_second": 4243785.497, "maximum_paired_speedup_ratio": 1.000199, "minimum_paired_speedup_ratio": 0.993791, "owned_entry_key_lookups_per_second": 4246870.777}, "run": 63, "segment": 42, "status": "discard", "timestamp": 1788433653020}
{"bestDirection": "higher", "maxIterations": 2, "metricName": "auth_cache_lookup_speedup_ratio", "metricUnit": "x", "name": "Confirm retained authorization cache path", "timestamp": 1788433716580, "type": "config"}
{"asi": {"bounded_resources": "All four authorization caches retain the same configured entry ceilings and expiration rules. Production request contexts hold one credential and no unrelated header or query collections.", "safety": "Every reused decision still performs the revocation lookup in the same order. Borrowed entry keys were measured separately and removed after no gain. Authorization policy, HTTP context, and Remote Execution transport tests passed.", "summary": "The retained authorization path uses fixed binary credential keys and synchronous bounded caches for hit-only entry and revocation state, while asynchronous per-key consultation coalescing remains on misses.", "validation": "Final paired confirmations improved the former key construction plus entry and revocation lookup path by 1.172642 and 1.213501 times. Earlier retained-shape runs improved it by 1.238488 to 1.277841 times."}, "commit": "6bfd9e30cd", "confidence": null, "description": "perf(kura): confirm streamlined authorization cache hits", "metric": 1.172642, "metrics": {"baseline_max_lookups_per_second": 1731013.176, "candidate_max_lookups_per_second": 2103115.766, "maximum_confirmation_speedup_ratio": 1.213501, "minimum_confirmation_speedup_ratio": 1.172642}, "run": 64, "segment": 43, "status": "keep", "timestamp": 1788433848542}
{"bestDirection": "higher", "maxIterations": 3, "metricName": "authorization_action_speedup_ratio", "metricUnit": "x", "name": "Remove authorization action case allocations", "timestamp": 1788433904202, "type": "config"}
{"asi": {"bounded_resources": "The change removes transient allocations and adds no retained state, queue, lock, or resource consumer.", "safety": "Byte slicing uses checked access with saturating subtraction, so short and non-ASCII input cannot panic. Equivalence tests cover every action suffix, mixed case, method fallback, short strings, and non-ASCII input.", "summary": "Authorization action classification now uses allocation-free case-insensitive byte checks instead of allocating lowercase operation and uppercase method strings.", "validation": "Three eight-worker paired runs improved classification by 9.036505, 9.272416, and 9.127046 times. The final run black-boxed runtime input and sustained 1.8819 billion decisions per second versus 205.1 million before."}, "commit": "2c37588", "confidence": null, "description": "perf(kura): classify authorization actions without allocation", "metric": 9.036505, "metrics": {"guarded_baseline_decisions_per_second": 205087671.39, "guarded_candidate_decisions_per_second": 1881891545.649, "guarded_confirmation_speedup_ratio": 9.127046, "maximum_paired_speedup_ratio": 9.272416, "minimum_paired_speedup_ratio": 9.036505}, "run": 65, "segment": 44, "status": "keep", "timestamp": 1788434422539}
{"bestDirection": "higher", "maxIterations": 4, "metricName": "authorization_target_speedup_ratio", "metricUnit": "x", "name": "Borrow canonical authorization targets", "timestamp": 1788434481650, "type": "config"}
