{"asi": {"hypothesis": "Resolve a record row once during inverse processing and reuse the capped tail column during preparation.", "result": "Selected bytes remain exactly 1098158. Receiver work measured 838.07 ms and peak process memory 617857024 bytes. Unchanged verification and patch phases also ran faster on this sample, indicating machine timing variation; confirm before attributing the full difference to lookups. All exact checks pass. Sparse decoder slots are bounded separately from descriptor count."}, "commit": "4112834", "confidence": 20.076266214238903, "description": "test(cache): avoid repeated bitstream column lookups", "metric": 838.0654199999999, "metrics": {"base_prepare_ms": 399.054167, "cold_bytes": 17648018.0, "copied_bytes": 66674091.0, "group_count": 8378.0, "metadata_bytes": 28312.0, "patch_ms": 197.01475, "peak_rss_bytes": 617857024.0, "prepared_bytes": 117453842.0, "restore_ms": 340.311127, "target_prepare_ms": 395.134666, "verify_ms": 98.70012600000001, "warm_bytes": 1098158.0}, "run": 27, "segment": 3, "status": "keep", "timestamp": 1788870137535}
{"asi": {"hypothesis": "Releasing expanded base and target buffers before full-node verification might reduce resident memory.", "result": "Receiver work measured 810.87 ms but peak process memory increased from 617857024 to 746225664 bytes, consistent with allocator retention depending on buffer lifetime. Reverted the lifetime-only experiment before logging. Preserved the additional malformed sparse-column regression test. Six-run segment complete; confirm the retained compact candidate and compiler consumers next."}, "commit": "4112834", "confidence": 4.794003628259208, "description": "Release experimental receiver buffers earlier", "metric": 810.867042, "metrics": {"base_prepare_ms": 386.182001, "cold_bytes": 17648018.0, "copied_bytes": 66674091.0, "group_count": 8378.0, "metadata_bytes": 28312.0, "patch_ms": 196.743292, "peak_rss_bytes": 746225664.0, "prepared_bytes": 117453842.0, "restore_ms": 329.839749, "target_prepare_ms": 393.075834, "verify_ms": 94.845292, "warm_bytes": 1098158.0}, "run": 28, "segment": 3, "status": "discard", "timestamp": 1788870207499}
{"bestDirection": "lower", "maxIterations": 6, "metricName": "receiver_peak_bytes", "metricUnit": "bytes", "name": "Swift isolated receiver memory", "timestamp": 1788872085291, "type": "config"}
{"asi": {"hypothesis": "Separate receiver allocations from sender scratch and earlier process retention before changing memory ownership.", "result": "Fresh receiver peak is 322191360 bytes, not the previous combined 617 MB. Selected bytes remain 1098158. Aggregate receiver work is 1392.32 ms including base and patch reads, both identity hashes, and output writes; process wall time is reported separately. All outputs match exactly. This is a new measurement baseline, not an optimization gain."}, "commit": "873a08f", "confidence": null, "description": "test(cache): isolate Swift patch receiver memory", "metric": 322191360.0, "metrics": {"prepared_bytes": 117453842.0, "receiver_ms": 1392.319792, "warm_bytes": 1098158.0, "worker_ms": 1426.677625}, "run": 29, "segment": 4, "status": "keep", "timestamp": 1788872120867}
{"asi": {"hypothesis": "Keep prepared fields separate and reference unchanged target pages instead of flattening and copying expanded buffers.", "result": "Receiver peak fell from 322191360 to 196526080 bytes, 39.0%, with aggregate receiver time 1378.56 ms versus 1392.32 ms. All five patch files match the original byte-for-byte. Fragmented cursor, inverse, copy-borrowing, and hash cross-check tests pass. This retains the complete base fields and is not streaming or constant memory."}, "commit": "1d44474", "confidence": null, "description": "test(cache): borrow unchanged Swift field pages during restoration", "metric": 196526080.0, "metrics": {"prepared_bytes": 117453842.0, "receiver_ms": 1378.5554590000002, "warm_bytes": 1098158.0, "worker_ms": 1410.44621}, "run": 30, "segment": 4, "status": "keep", "timestamp": 1788872455075}
{"asi": {"hypothesis": "Shrink owned column and layout capacity after preparation to reduce receiver resident memory.", "result": "No improvement in worst receiver peak: 196542464 versus 196526080 bytes. Header peak fell slightly but the large Swift case was unchanged. Resident bytes are not the same as reserved vector capacity. Removed the trim method and configuration before logging."}, "commit": "1d44474", "confidence": 7670.0, "description": "Trim spare prepared-field capacity", "metric": 196542464.0, "metrics": {"prepared_bytes": 117453842.0, "receiver_ms": 1373.3227900000002, "warm_bytes": 1098158.0, "worker_ms": 1404.180958}, "run": 31, "segment": 4, "status": "discard", "timestamp": 1788872549357}
{"asi": {"hypothesis": "With separate field buffers and fresh workers, releasing raw base bytes after preparation and prepared pages after inverse processing may reduce overlap.", "result": "Receiver peak fell to 164823040 bytes, 16.1% below the segmented candidate and 48.8% below baseline, with unchanged patch sizes and 1376.12 ms aggregate work. This differs from the earlier failed combined-buffer experiment: the representation and measured process lifetime changed. All exact checks passed."}, "commit": "fd14e56", "confidence": 9.922520661157025, "description": "test(cache): release segmented receiver state after its last use", "metric": 164823040.0, "metrics": {"prepared_bytes": 117453842.0, "receiver_ms": 1376.120708, "warm_bytes": 1098158.0, "worker_ms": 1405.4327910000002}, "run": 32, "segment": 4, "status": "keep", "timestamp": 1788872612437}
{"asi": {"hypothesis": "Use the bounded file size to avoid growth allocations while reading receiver inputs.", "result": "Worst receiver peak remained 164855808 bytes, with slightly worse small-output peaks. Timing improved only about 1%, within variation. Restored the existing bounded reader before logging because the primary memory metric did not improve."}, "commit": "fd14e56", "confidence": 4.968960165545783, "description": "Preallocate receiver file reads exactly", "metric": 164855808.0, "metrics": {"prepared_bytes": 117453842.0, "receiver_ms": 1361.1315, "warm_bytes": 1098158.0, "worker_ms": 1389.901668}, "run": 33, "segment": 4, "status": "discard", "timestamp": 1788872686118}
{"asi": {"hypothesis": "Confirm retained memory gains and provide a same-process repeated-restore probe before drawing conclusions about persistent workers.", "result": "Confirmed 164937728 peak receiver bytes, 48.8% below the 322191360-byte baseline; 1391.83 ms work is effectively unchanged from 1392.32 ms. Transfer bytes remain exactly 1098158. Fifteen shared codec tests pass. The new receive-many mode will measure repeated same-process retention separately, outside the fresh-worker primary metric. Six-run segment complete."}, "commit": "758616b", "confidence": 9.932781799379525, "description": "test(cache): confirm isolated receiver gains and add retention probe", "metric": 164937728.0, "metrics": {"prepared_bytes": 117453842.0, "receiver_ms": 1391.827625, "warm_bytes": 1098158.0, "worker_ms": 1421.9031250000003}, "run": 34, "segment": 4, "status": "keep", "timestamp": 1788872778222}
