{"bestDirection": "lower", "maxIterations": 8, "metricName": "warm_bytes", "metricUnit": "bytes", "name": "Xcode compression boundary search", "timestamp": 1788859368711, "type": "config"}
{"asi": {"hypothesis": "Establish the existing 512 KiB raw compression boundary baseline.", "result": "Ten output pairs restore exactly; warm bytes 50368290, cold bytes 60615810. Encoding 575 ms and decoding 239 ms are single-sample observations."}, "commit": "c5b4337", "confidence": null, "description": "test(cache): add byte-exact Xcode output optimization workload", "metric": 50368290.0, "metrics": {"cold_bytes": 60615810.0, "decode_ms": 239.219416, "encode_ms": 575.0229180000001, "metadata_bytes": 7920.0}, "run": 1, "segment": 0, "status": "keep", "timestamp": 1788859540991}
{"asi": {"hypothesis": "Smaller raw compression frames preserve more nearby unchanged data.", "result": "Actual Swift module improved by 857119 payload bytes, but aggregate warm bytes regressed 1.73%, including the large Swift module and C object. Cold bytes grew 1.10%."}, "commit": "c5b4337", "confidence": null, "description": "test(cache): reject 128 KiB compression boundaries", "metric": 51240657.0, "metrics": {"cold_bytes": 61282171.0, "decode_ms": 242.362501, "encode_ms": 635.496292, "metadata_bytes": 8160.0}, "run": 2, "segment": 0, "status": "discard", "timestamp": 1788859553120}
{"asi": {"hypothesis": "Even smaller raw frames may compensate for the second chunking layer.", "result": "Warm transfer regressed 2.99%, cold bytes 1.45%, and encoding 19.6%. Smaller frames are not monotonically better with the negotiated transfer chunker."}, "commit": "c5b4337", "confidence": null, "description": "test(cache): reject 64 KiB compression boundaries", "metric": 51873554.0, "metrics": {"cold_bytes": 61495289.0, "decode_ms": 257.392834, "encode_ms": 687.575833, "metadata_bytes": 7600.0}, "run": 3, "segment": 0, "status": "discard", "timestamp": 1788859564073}
{"asi": {"hypothesis": "Larger raw frames may reduce overhead while retaining stable boundaries.", "result": "Cold bytes improved 0.33%, but warm bytes regressed 7.30%, dominated by the large Swift module. Retain the baseline."}, "commit": "c5b4337", "confidence": null, "description": "test(cache): reject 1 MiB compression boundaries", "metric": 54045186.0, "metrics": {"cold_bytes": 60416460.0, "decode_ms": 250.705543, "encode_ms": 563.379458, "metadata_bytes": 7600.0}, "run": 4, "segment": 0, "status": "discard", "timestamp": 1788859577022}
{"asi": {"hypothesis": "Reset compression boundaries at object sections and relocation tables to isolate independently changing regions.", "result": "Warm bytes fell 1.17% overall: C object payload fell 24.1%, Swift object 0.98%. Cold size and encoding did not regress. This remains a research-only parser, not production code."}, "commit": "1d9e1e0", "confidence": 0.6761878888128505, "description": "test(cache): retain object-section boundary candidate", "metric": 49778406.0, "metrics": {"cold_bytes": 60604770.0, "decode_ms": 246.007416, "encode_ms": 564.012542, "metadata_bytes": 7920.0}, "run": 5, "segment": 0, "status": "keep", "timestamp": 1788859587956}
{"asi": {"hypothesis": "Stronger compression may lower both cold and warm bytes with section boundaries.", "result": "Cold bytes fell 2.25% versus the candidate, but warm bytes rose 4.70% and encoding took 28.7% longer. The C object lost most of its chunk matches."}, "commit": "1d9e1e0", "confidence": 0.673631944198603, "description": "test(cache): reject stronger compression for warm transfers", "metric": 52119644.0, "metrics": {"cold_bytes": 59253654.0, "decode_ms": 267.11725, "encode_ms": 725.829042, "metadata_bytes": 7760.0}, "run": 6, "segment": 0, "status": "discard", "timestamp": 1788859601543}
{"asi": {"hypothesis": "Combine object sections with intermediate compression frame sizes.", "result": "Swift object improved 7.0% from the best candidate, but C object regressed 47.8%. Aggregate warm bytes rose 0.24%, so do not replace the candidate."}, "commit": "1d9e1e0", "confidence": 0.6710952494177957, "description": "test(cache): reject 256 KiB section compression frames", "metric": 49897967.0, "metrics": {"cold_bytes": 60973732.0, "decode_ms": 260.98645899999997, "encode_ms": 604.4098339999999, "metadata_bytes": 7680.0}, "run": 7, "segment": 0, "status": "discard", "timestamp": 1788859618336}
{"asi": {"hypothesis": "Small frames and object-section boundaries might combine their individual gains.", "result": "Warm bytes regressed 3.97% from the best candidate; stop this eight-run segment. Retain 512 KiB with section boundaries as research only, and investigate duplicate reads before adding a shipping parser."}, "commit": "1d9e1e0", "confidence": 0.673631944198603, "description": "test(cache): reject 128 KiB section compression frames", "metric": 51753469.0, "metrics": {"cold_bytes": 61259078.0, "decode_ms": 253.35354400000003, "encode_ms": 637.992374, "metadata_bytes": 8080.0}, "run": 8, "segment": 0, "status": "discard", "timestamp": 1788859631141}
{"bestDirection": "lower", "maxIterations": 8, "metricName": "warm_bytes", "metricUnit": "bytes", "name": "Native Swift patch preparation and reconstruction", "timestamp": 1788861928582, "type": "config"}
{"asi": {"hypothesis": "Establish a native raw-dictionary baseline with complete compressed-node identity checks.", "result": "Default-history raw patches barely help: 1753183 selected bytes across three edits. The body-only module is already identical. All bounds and reconstruction tests pass."}, "commit": "5b7704b", "confidence": null, "description": "test(cache): benchmark native Swift patch round trips", "metric": 1753183.0, "metrics": {"base_prepare_ms": 0.12454100000000001, "cold_bytes": 2339828.0, "patch_ms": 10.186334, "peak_rss_bytes": 26853376.0, "prepared_bytes": 6075692.0, "restore_ms": 4.529999999999999, "target_prepare_ms": 0.16029200000000002, "verify_ms": 15.002333}, "run": 9, "segment": 1, "status": "keep", "timestamp": 1788861967130}
{"asi": {"hypothesis": "A full-history window may recover more matches without parsing Swift.", "result": "Only 38 fewer selected bytes overall, 0.0022%. Retained as a measured configuration but not a meaningful win. Public/enum/hashing selected sizes: 587942/582695/582508."}, "commit": "e2bb43d", "confidence": null, "description": "test(cache): measure a wider raw dictionary window", "metric": 1753145.0, "metrics": {"base_prepare_ms": 0.125375, "cold_bytes": 2339828.0, "patch_ms": 10.723041, "peak_rss_bytes": 26853376.0, "prepared_bytes": 6075692.0, "restore_ms": 4.464417, "target_prepare_ms": 0.123499, "verify_ms": 14.813040999999998}, "run": 10, "segment": 1, "status": "keep", "timestamp": 1788861997372}
{"asi": {"hypothesis": "Native field separation exposes stable values despite bit-packed reference churn.", "result": "Selected bytes 494433/490047/490669, 15.9% better aggregate. Preparation 26-27 ms and restoration 27 ms per module; complete identity checks pass. Peak process memory 179666944 bytes. Default dictionary matching still resembles whole prepared compression."}, "commit": "856ed82", "confidence": 7316.684210526316, "description": "test(cache): retain native field-separated Swift patch baseline", "metric": 1475149.0, "metrics": {"base_prepare_ms": 78.970457, "cold_bytes": 2339828.0, "patch_ms": 30.827416999999997, "peak_rss_bytes": 179666944.0, "prepared_bytes": 36843463.0, "restore_ms": 81.049791, "target_prepare_ms": 80.849542, "verify_ms": 14.935917}, "run": 11, "segment": 1, "status": "keep", "timestamp": 1788862016751}
{"asi": {"hypothesis": "A larger history window may improve field matching.", "result": "Selected bytes rose 0.63% to 1484429. A window alone is insufficient; inspect how the command-line patch mode configures long-distance matching before tuning more sizes."}, "commit": "856ed82", "confidence": 2.069059437254887, "description": "test(cache): reject wider field dictionary window alone", "metric": 1484429.0, "metrics": {"base_prepare_ms": 78.733791, "cold_bytes": 2339828.0, "patch_ms": 30.82771, "peak_rss_bytes": 179535872.0, "prepared_bytes": 36843463.0, "restore_ms": 78.729624, "target_prepare_ms": 80.077417, "verify_ms": 14.935375}, "run": 12, "segment": 1, "status": "discard", "timestamp": 1788862038640}
{"asi": {"hypothesis": "Match the command-line patch mode by enabling long-distance matching as well as a larger history.", "result": "Selected bytes 434842/432666/432144, aggregate 1299652. Receiver work with fresh base preparation stays near 58 ms per module. Still weaker than the historical command-line patches; inspect prefix versus dictionary treatment."}, "commit": "edfaf22", "confidence": 2.45447755943651, "description": "test(cache): retain explicit long-distance Swift matching", "metric": 1299652.0, "metrics": {"base_prepare_ms": 79.25758300000001, "cold_bytes": 2339828.0, "patch_ms": 70.209917, "peak_rss_bytes": 179650560.0, "prepared_bytes": 36843463.0, "restore_ms": 76.83891700000001, "target_prepare_ms": 79.813459, "verify_ms": 15.001124999999998}, "run": 13, "segment": 1, "status": "keep", "timestamp": 1788862106875}
{"asi": {"hypothesis": "The command-line patch engine references the previous file as a prefix, not an ordinary dictionary.", "result": "Native prefix matching reproduces the earlier gains: selected public/enum/hashing bytes 205206/85873/213112. Fresh-base receiver work is 55-57 ms per module including compressed identity verification. Peak memory 173850624 bytes; all exact checks pass."}, "commit": "d35b2fc", "confidence": 5.508318761259821, "description": "test(cache): use native prefix references for Swift patch research", "metric": 504191.0, "metrics": {"base_prepare_ms": 79.202, "cold_bytes": 2339828.0, "patch_ms": 67.220209, "peak_rss_bytes": 173850624.0, "prepared_bytes": 36843463.0, "restore_ms": 72.762209, "target_prepare_ms": 79.794792, "verify_ms": 14.861916999999998}, "run": 14, "segment": 1, "status": "keep", "timestamp": 1788862159462}
{"asi": {"hypothesis": "Prefix semantics alone might make field separation unnecessary.", "result": "This comparison measures the raw-prefix alternative without changing compiler serialization. See recorded payload and timing metrics; retain the field candidate only if it saves more bytes within the receiver budget."}, "commit": "d35b2fc", "confidence": 7.116885188920608, "description": "test(cache): compare raw prefix patches with field preparation", "metric": 1307491.0, "metrics": {"base_prepare_ms": 0.12995800000000002, "cold_bytes": 2339828.0, "patch_ms": 17.316583, "peak_rss_bytes": 38961152.0, "prepared_bytes": 6075692.0, "restore_ms": 3.217, "target_prepare_ms": 0.134583, "verify_ms": 16.090499}, "run": 15, "segment": 1, "status": "discard", "timestamp": 1788862201100}
{"asi": {"hypothesis": "Compression level three may modestly improve the now-correct prefix patcher.", "result": "Selected bytes 200083/92071/208557, total 500711. Aggregate improves 0.69% from level one but the enum case regresses; sender patch time rises about 9%. Receiver cost and memory remain within research budgets. Stop this eight-run segment and validate native outputs and scale."}, "commit": "97b9286", "confidence": 5.506170125776486, "description": "test(cache): measure the stronger native Swift patch candidate", "metric": 500711.0, "metrics": {"base_prepare_ms": 78.859041, "cold_bytes": 2339828.0, "patch_ms": 73.116833, "peak_rss_bytes": 178864128.0, "prepared_bytes": 36843463.0, "restore_ms": 72.141707, "target_prepare_ms": 79.742333, "verify_ms": 14.872500000000002}, "run": 16, "segment": 1, "status": "keep", "timestamp": 1788862250284}
{"bestDirection": "lower", "maxIterations": 6, "metricName": "warm_bytes", "metricUnit": "bytes", "name": "Bounded-group Swift patch search with large outputs", "timestamp": 1788862835502, "type": "config"}
{"asi": {"hypothesis": "Measure the existing monolithic patcher on the expanded corpus before grouping.", "result": "10195001 selected bytes, 1809727488 peak process bytes. All five changed artifacts and compressed nodes restore exactly. This is a baseline exceeding the 512 MiB research budget, not a promotable candidate."}, "commit": "ffa122c", "confidence": null, "description": "test(cache): establish large-output Swift patch search baseline", "metric": 10195001.0, "metrics": {"base_prepare_ms": 637.7667489999999, "cold_bytes": 17648018.0, "patch_ms": 709.235373, "peak_rss_bytes": 1809727488.0, "prepared_bytes": 309728330.0, "restore_ms": 668.3926670000001, "target_prepare_ms": 655.182541, "verify_ms": 146.547209}, "run": 17, "segment": 2, "status": "keep", "timestamp": 1788862900745}
{"asi": {"hypothesis": "Four-mebibyte pages might improve matching with less metadata; preallocation and releasing the target might reduce memory.", "result": "2205669 selected bytes is worse than the preliminary one-mebibyte result of 1783604. Memory still peaks at 1832124416 despite shorter buffer lifetimes. Restore one-mebibyte pages; retain neutral buffer hygiene for the next measurement. Preliminary one-mebibyte metrics are documented separately because the helper required explicit acceptance of the new secondary metrics."}, "commit": "ffa122c", "confidence": null, "description": "test(cache): reject larger Swift field pages", "metric": 2205669.0, "metrics": {"base_prepare_ms": 582.539458, "cold_bytes": 17648018.0, "copied_bytes": 197130428.0, "group_count": 8044.0, "metadata_bytes": 233716.0, "patch_ms": 1804.371248, "peak_rss_bytes": 1832124416.0, "prepared_bytes": 309728330.0, "restore_ms": 2131.420792, "target_prepare_ms": 583.283666, "verify_ms": 140.205666}, "run": 18, "segment": 2, "status": "discard", "timestamp": 1788863035595}
{"asi": {"hypothesis": "Confirm the smaller field pages after removing needless expanded-buffer overlap.", "result": "Confirmed 1783604 selected bytes, including 237544 metadata bytes. Large Swift transfer 159051, header 1100492. All exact checks pass. Small receiver work remains under 150 ms but scale peak 1805320192 remains unacceptable for shipping; this is a byte-reuse research result."}, "commit": "405e8bf", "confidence": 19.929150723229835, "description": "test(cache): retain one-mebibyte field-group patches", "metric": 1783604.0, "metrics": {"base_prepare_ms": 584.2562909999999, "cold_bytes": 17648018.0, "copied_bytes": 207910252.0, "group_count": 8176.0, "metadata_bytes": 237544.0, "patch_ms": 1791.0294589999999, "peak_rss_bytes": 1805320192.0, "prepared_bytes": 309728330.0, "restore_ms": 2132.0783340000003, "target_prepare_ms": 582.662707, "verify_ms": 139.98679099999998}, "run": 19, "segment": 2, "status": "keep", "timestamp": 1788863077458}
{"asi": {"hypothesis": "Bytewise differences can compress reference churn that does not leave long exact matches, following the binary-patching research.", "result": "Selected bytes 1538335, 13.8% below grouped prefix-only. Header fell to 867836 and large Swift to 155237. Every module and complete compressed node remained exact. Added computation and high scale memory still prevent promotion."}, "commit": "83a5ed2", "confidence": 25.94402802794403, "description": "test(cache): retain sparse byte differences for Swift field groups", "metric": 1538335.0, "metrics": {"base_prepare_ms": 604.645792, "cold_bytes": 17648018.0, "copied_bytes": 207910252.0, "group_count": 8176.0, "metadata_bytes": 237544.0, "patch_ms": 1879.7977489999998, "peak_rss_bytes": 1845166080.0, "prepared_bytes": 309728330.0, "restore_ms": 2127.4529570000004, "target_prepare_ms": 589.616959, "verify_ms": 140.46112399999998}, "run": 20, "segment": 2, "status": "keep", "timestamp": 1788863149724}
{"asi": {"hypothesis": "Thousands of repetitive group descriptors should compress well without recompressing patch payloads.", "result": "Selected bytes 1324969. Actual metadata dropped from 237544 to 24178 bytes. Public/enum/hashing edits now all improve over monolithic patches. Large Swift 126713 and header 819298. Group metadata has explicit decompression and count bounds; byte-difference wraparound test passes."}, "commit": "31fa102", "confidence": 21.015796145143522, "description": "test(cache): compress field-patch metadata separately", "metric": 1324969.0, "metrics": {"base_prepare_ms": 585.119501, "cold_bytes": 17648018.0, "copied_bytes": 207910252.0, "group_count": 8176.0, "metadata_bytes": 24178.0, "patch_ms": 1881.890708, "peak_rss_bytes": 1804697600.0, "prepared_bytes": 309728330.0, "restore_ms": 2137.009167, "target_prepare_ms": 586.8814600000001, "verify_ms": 140.390917}, "run": 21, "segment": 2, "status": "keep", "timestamp": 1788863188465}
{"asi": {"hypothesis": "With compressed metadata, smaller pages may isolate edits without an excessive descriptor penalty.", "result": "1243833 selected bytes, 6.1% below one-mebibyte pages and 87.8% below the monolithic patch baseline. Large Swift now 90124 bytes, header 776089, public/enum/hashing 158211/50307/169102. Peak process memory remains 1821573120. Stop this six-run segment and verify exported compiler consumers; do not promote the all-in-memory codec."}, "commit": "2319e49", "confidence": 23.77035784989982, "description": "test(cache): retain smaller bounded Swift field pages", "metric": 1243833.0, "metrics": {"base_prepare_ms": 598.394751, "cold_bytes": 17648018.0, "copied_bytes": 213065780.0, "group_count": 8912.0, "metadata_bytes": 25990.0, "patch_ms": 1878.591832, "peak_rss_bytes": 1821573120.0, "prepared_bytes": 309728330.0, "restore_ms": 2147.023792, "target_prepare_ms": 586.090834, "verify_ms": 143.34325}, "run": 22, "segment": 2, "status": "keep", "timestamp": 1788863247548}
{"bestDirection": "lower", "maxIterations": 6, "metricName": "receiver_ms", "metricUnit": "ms", "name": "Swift grouped-patch receiver cost", "timestamp": 1788869576601, "type": "config"}
{"asi": {"hypothesis": "Measure receiver work before changing verification or preparation.", "result": "Same 1243833 selected bytes. Receiver phase medians total 2897.327375 ms across five edits, peak process memory 1849032704 bytes. Exact reconstruction and focused checks passed."}, "commit": "0fe9d46", "confidence": null, "description": "test(cache): baseline grouped-patch receiver work", "metric": 2897.327375, "metrics": {"base_prepare_ms": 604.1497909999999, "cold_bytes": 17648018.0, "copied_bytes": 213065780.0, "group_count": 8912.0, "metadata_bytes": 25990.0, "patch_ms": 1886.2555419999999, "peak_rss_bytes": 1849032704.0, "prepared_bytes": 309728330.0, "restore_ms": 2150.8465850000002, "target_prepare_ms": 583.68721, "verify_ms": 142.33099900000002, "warm_bytes": 1243833.0}, "run": 23, "segment": 3, "status": "keep", "timestamp": 1788869640198}
{"asi": {"hypothesis": "Use the existing transport cryptography dependency for the same patch digests, without changing production hashing.", "result": "Receiver work fell from 2897 to 1697 ms across five pairs. Selected bytes remain exactly 1243833; hash cross-checks and cross-decoding pass. Peak memory remains 1840316416 bytes. Ring is a development-only direct dependency already present transitively; production source and dependency features are unchanged."}, "commit": "7a820c4", "confidence": null, "description": "test(cache): accelerate experimental patch verification", "metric": 1697.164459, "metrics": {"base_prepare_ms": 651.1095, "cold_bytes": 17648018.0, "copied_bytes": 213065780.0, "group_count": 8912.0, "metadata_bytes": 25990.0, "patch_ms": 637.3547080000001, "peak_rss_bytes": 1840316416.0, "prepared_bytes": 309728330.0, "restore_ms": 897.7639180000001, "target_prepare_ms": 648.5990429999999, "verify_ms": 148.291041, "warm_bytes": 1243833.0}, "run": 24, "segment": 3, "status": "keep", "timestamp": 1788869738937}
{"asi": {"hypothesis": "Run-length encode repeated operation spelling without changing field values or original padding.", "result": "Receiver work 1594.59 ms, selected bytes 1223691, expanded bytes 246416609. Peak process memory fell to 1148846080. All exact checks pass, including compact representation mutations, malformed runs, and integer extremes. Numeric-column compaction is implemented for the next configuration but disabled in this measurement."}, "commit": "5ae608e", "confidence": 12.700692155055735, "description": "test(cache): compact repeated bitstream layouts", "metric": 1594.5925, "metrics": {"base_prepare_ms": 610.335, "cold_bytes": 17648018.0, "copied_bytes": 169043461.0, "group_count": 8671.0, "metadata_bytes": 25415.0, "patch_ms": 479.91833299999996, "peak_rss_bytes": 1148846080.0, "prepared_bytes": 246416609.0, "restore_ms": 839.9890829999999, "target_prepare_ms": 604.385708, "verify_ms": 144.268417, "warm_bytes": 1223691.0}, "run": 25, "segment": 3, "status": "keep", "timestamp": 1788869823767}
{"asi": {"hypothesis": "Small signed field differences should take fewer bytes while preserving the exact original spelling separately.", "result": "Receiver work fell to 1511.93 ms; selected bytes 1098158, 11.7% below baseline. Prepared bytes fell to 117453842 and peak process memory to 619544576, still above the 512 MiB promotion budget. All focused checks and exact compiler-output and compressed-node reconstruction passed."}, "commit": "9714ac0", "confidence": 14.958483378274515, "description": "test(cache): compact field-column integer differences", "metric": 1511.932456, "metrics": {"base_prepare_ms": 606.645499, "cold_bytes": 17648018.0, "copied_bytes": 66674091.0, "group_count": 8378.0, "metadata_bytes": 28312.0, "patch_ms": 287.962711, "peak_rss_bytes": 619544576.0, "prepared_bytes": 117453842.0, "restore_ms": 761.950957, "target_prepare_ms": 608.915, "verify_ms": 143.336, "warm_bytes": 1098158.0}, "run": 26, "segment": 3, "status": "keep", "timestamp": 1788870061879}
